,product_name,price,weight,category
2448,Ashfields 30 Day Matured British Beef Roasting Joint Typically 1.025kg,£10.75,Typically 1.025kg,fresh-food
2449,The Foodie Market Blackcurrant Dinos 5x20g,£1.69,5x20g,fresh-food
2450,Ashfields British Diced Beef 400g,£4.19,400g,fresh-food
2451,Ashfields British Beef Meatballs 680g/24 Pack,£4.29,680g,fresh-food
2452,Ashfields British Beef Quarter Pounders 454g/4 Pack,£2.49,454g,fresh-food
2453,Everyday Essentials British Beef Steak 227g,£2.99,227g,fresh-food
2454,Nature's Glen 7 Day Matured Extra Lean Diced Steak 350g,£3.99,350g,fresh-food
2455,Nature's Glen Scotch Diced Beef 400g,£4.19,400g,fresh-food
2456,Nature's Glen Scotch Beef Meatballs 340g/12 Pack,£2.49,340g,fresh-food
2457,Nature's Glen 21 Day Matured Scotch Beef Steak 227g,£2.99,227g,fresh-food
2458,Nature's Glen 21 Day Matured Scotch Ribeye Steak 195g,£3.99,195g,fresh-food
2459,Nature's Glen 21 Day Matured Scotch Sirloin Steak 195g,£3.69,195g,fresh-food
2460,Nature's Glen 21 Day Matured Scotch Rump Steak 232g,£3.49,232g,fresh-food
2461,Nature's Glen 100% Scotch Fillet Steak 170g,£5.29,170g,fresh-food
2462,Nature's Glen 30 Day Matured 100% Scotch Ribeye Steak 227g,£5.29,227g,fresh-food
2463,Nature's Glen 30 Day Matured Scotch Rump Steak 255g,£4.25,255g,fresh-food
2464,Nature's Glen 28 Day Matured Scotch Fillet Steaks 340g/2 Pack,£9.99,340g,fresh-food
2465,Ashfields British 21 Day Matured Sirloin Steak 195g,£3.69,195g,fresh-food
2466,Ashfields British 21 Day Matured Rump Steak 232g,£3.49,232g,fresh-food
2467,Ashfields British 21 Day Matured Ribeye Steak 195g,£3.99,195g,fresh-food
2468,Ashfields 100% British 30 Day Matured Rump Steak 255g,£4.25,255g,fresh-food
2469,Ashfields King Of Steaks 12oz Sirloin Steak 340g,£6.99,340g,fresh-food
2470,Ashfields 100% British 30 Day Matured Ribeye Steak 227g,£5.29,227g,fresh-food
2471,Ashfields Ready To Cook Salt & Chilli Pork Belly Slices 400g,£3.59,400g,fresh-food
2472,Ashfields Ready To Cook Mediterranean Style Pork Loin Steaks 440g/4 Pack,£3.19,440g,fresh-food
2473,Edwards 6 Succulent Honey & Mustard Pork Sausages 400g,£2.75,400g,fresh-food
2474,Nature's Glen 30 Day Matured Scotch Beef Roasting Joint Typically 1.025kg,£10.75,Typically 1.025kg,fresh-food
2475,Specially Selected Scottish Loch Trout Fillets 240g/2 Pack,£3.99,240g,fresh-food
2476,Macaulay's Steak Sausages 300g,£1.99,300g,fresh-food
2477,Specially Selected Beer Battered Cod Fillets 350g/2 Pack,£3.65,350g,fresh-food
2478,Specially Selected Blueberries 250g,£2.89,250g,fresh-food
2479,Vici Large Surimi Tails In Brine 320g (200g Drained),£1.99,320g (200g Drained),fresh-food
2480,The Fishmonger Scottish Smoked Salmon Trimmings 100g,£1.49,100g,fresh-food
2481,Ashfields Sweet Chilli Chicken Breast Fillets 316g/2 Pack,£2.75,316g,fresh-food
2482,Ashfields Ready To Cook Cajun Chicken Breast Fillets 275g/2 Pack,£2.75,275g,fresh-food
2483,Ashfields British Beef Medallion Steaks 340g,£3.99,340g,fresh-food
2484,The Foodie Market Banana Chips 230g,£1.39,230g,fresh-food
2485,Macaulay's Beef Olives 400g/4 Pack,£3.49,400g,fresh-food
2486,Riverway Irish Recipe Style 8 Pork Sausages 410g,£1.35,410g,fresh-food
2487,Macaulay's Black Pudding Slices 240g/4 Pack,£1.25,240g,fresh-food
2488,The Fishmonger Skinless & Boneless Breaded Fish Fillets 600g/4 Pack,£2.99,600g,fresh-food
2489,Oakhurst Smoked Back Bacon 2x250g/14 Pack,£2.89,2x250g,fresh-food
2490,Specially Selected Skinless & Boneless Cod Loins 260g/2 Pack,£4.49,260g,fresh-food
2491,Shazans Chicken Drumsticks 1kg,£4.29,1kg,fresh-food
2492,Shazans Chicken Mini Fillets 500g,£4.49,500g,fresh-food
2493,Shazans Chicken Breast Fillets 950g,£6.79,950g,fresh-food
2494,Shazans Chicken Thigh Fillets 600g,£4.49,600g,fresh-food
2495,Nature's Pick Vegetable Soup Mix 600g,£0.99,600g,fresh-food
2496,Nature's Pick Swede Each - Minimum 600g,£0.62,Each - Minimum 600g,fresh-food
2497,Nature's Pick Pak Choi 250g,£0.99,250g,fresh-food
2498,Everyday Essentials Family Pack Peppers 600g,£1.60,600g,fresh-food
2499,"The Fishmonger Garlic, Chilli & Coriander Marinated King Prawns 150g",£2.69,150g,fresh-food
2500,The Fishmonger Tempura Haddock Fillets 300g,£3.29,300g,fresh-food
2501,Nature's Pick Large Cucumber Each,£0.99,EACH,fresh-food
2502,Nature's Pick Sweet Vine Ripened Tomatoes 255g,£0.95,255g,fresh-food
2503,Nature's Pick Cherry Tomatoes 330g,£0.95,330g,fresh-food
2504,Nature's Pick Family Pack Salad Tomatoes 650g,£1.39,650g,fresh-food
2505,Specially Selected Regal Vine Tomatoes 450g,£1.79,450g,fresh-food
2506,Everyday Essentials Cherry Tomatoes 250g,£0.69,250g,fresh-food
2507,The Fishmonger Salt & Vinegar Tempura Haddock Fillets 300g,£3.29,300g,fresh-food
2508,Nature's Glen Scottish Chicken Thigh Fillets 900g,£5.19,900g,fresh-food
2509,The Fishmonger Hot Smoked Salmon Flakes 100g,£2.49,100g,fresh-food
2510,The Fishmonger Hot Smoked Salmon Flakes With Honey Flavouring 100g,£2.49,100g,fresh-food
2511,The Foodie Market Raspberry Dinos 20g,£0.33,20g,fresh-food
2512,The Foodie Market Strawberry Dinos 20g,£0.33,20g,fresh-food
2513,Organic Cucumber Each,£0.99,Each,fresh-food
2514,Everyday Essentials Baby Plum Tomatoes 250g,£0.69,250g,fresh-food
2515,Nature's Pick Lettuce Sweet Gem 2 Pack,£0.69,2 pack,fresh-food
2516,Nature's Glen Chicken Legs 1kg,£2.29,1kg,fresh-food
2517,Specially Selected Smoked Scottish Back Bacon Medallions 160g,£1.99,160g,fresh-food
2518,Specially Selected Unsmoked Scottish Back Bacon Medallions 160g/8 Pack,£1.99,160g,fresh-food
2519,Specially Selected Mini San Marzano Tomatoes 250g,£1.69,250g,fresh-food
2520,Nature's Pick Celery Sticks 350g,£0.99,350g,fresh-food
2521,Nature's Pick Tenderstem Broccoli 200g,£1.49,200g,fresh-food
2522,The Foodie Market Strawberry Dinos 5x20g,£1.69,5x20g,fresh-food
2523,Nature's Pick Purple Sprouting Broccoli 200g,£1.39,200g,fresh-food
2524,Ashfields 30 Day Matured King Of Steaks 12oz Sirloin Steak 340g,£6.99,340g,fresh-food
2525,Nature's Pick Carrot Batons 400g,£0.89,400g,fresh-food
2526,The Foodie Market Raspberry Dinos 5x20g,£1.69,5x20g,fresh-food
2527,"Nature's Pick Peas, Cabbage & Tenderstem Broccoli 240g",£1.79,240g,fresh-food
2528,Specially Selected Piccolato Tomatoes 220g,£1.79,220g,fresh-food
2529,Nature's Pick Red Chillies 65g,£0.57,65g,fresh-food
2530,The Fishmonger Boneless Smoked Haddock Fillets 230g/2 Pack,£3.79,230g,fresh-food
2531,Nature's Pick Blueberries 150g,£1.79,150g,fresh-food
2532,Nature's Pick Pineapple Each,£0.99,Each,fresh-food
2533,Specially Selected Pork Sausages 400g/6 Pack,£2.49,400g,fresh-food
2534,Ashfields Lean Chicken Mince 500g,£2.49,500g,fresh-food
2535,Ashfields British Pork Crackling Leg Joint Typically 1.5kg,£7.94,Typically 1.5kg,fresh-food
2536,Ashfields British Pork Shoulder Joint Typically 1.5kg,£5.99,Typically 1.5kg,fresh-food
2537,Simon Howie The Scottish Butcher Traditional White Puddings (220g) 2x110g,£1.39,2x110g,fresh-food
2538,The Fishmonger Tempura Battered King Prawns 200g,£2.69,200g,fresh-food
2539,Specially Selected Pork Chorizo Style Pork Sausages 400g/6 Pack,£2.49,400g,fresh-food
2540,Specially Selected Skinless & Boneless Cod Loins 260g,£4.49,260g,fresh-food
2541,Nature's Pick Loose Red Peppers Each,£0.49,Each,fresh-food
2542,The Fishmonger Tomato & Basil Marinated King Prawns 150g,£2.69,150g,fresh-food
2543,Nature's Pick Bistro Salad 160g,£0.69,160g,fresh-food
2544,Nature's Pick Baby Leaf Salad 110g,£0.79,110g,fresh-food
2545,"Nature's Pick Watercress, Spinach & Rocket 80g",£0.59,80g,fresh-food
2546,Nature's Pick Classic Salad 145g,£0.69,145g,fresh-food
2547,Nature's Pick Sweet & Crispy Salad 190g,£0.99,190g,fresh-food
2548,The Fishmonger Hot Smoked Salmon Fillets 185g/2 Pack,£3.99,185g,fresh-food
2549,The Fishmonger Hot Smoked Lemon & Parsley Salmon Fillets 185g/2 Pack,£3.99,185g,fresh-food
2550,The Fishmonger Hot Smoked Sweet Chilli Salmon Fillets 185g/2 Pack,£3.99,185g,fresh-food
2551,Macaulay's Haggis Slices 240g,£0.99,240g,fresh-food
2552,Nature's Pick Pomegranate Seeds 80g,£0.89,80g,fresh-food
2553,Nature's Pick Italian Style Salad 100g,£0.69,100g,fresh-food
2554,Nature's Pick Loose Sweet Potatoes Each,£0.69,Each ,fresh-food
2555,Everyday Essentials Unsmoked Gammon Joint Typically 1kg,£4.29,Typically 1kg,fresh-food
2556,Nature's Pick Baby Cucumbers 200g,£0.95,200g,fresh-food
2557,The Fishmonger Hot Smoked Salmon Flakes With A Chilli Glaze 100g,£2.49,100g,fresh-food
2558,Oakhurst Smoked Bacon Lardons 200g,£1.99,200g,fresh-food
2559,Oakhurst Unsmoked Bacon Lardons 200g,£1.99,200g,fresh-food
2560,Specially Selected The Ultimate Burger 340g,£2.99,340g,fresh-food
2561,Nature's Pick Grapefruit Each,£0.29,Each,fresh-food
2562,Nature's Glen Chicken Breast Mini Fillets 400g,£2.99,400g,fresh-food
2563,Nature's Pick Mixed Leaf Salad 120g,£0.57,120g,fresh-food
2564,Nature's Pick Crispy Leaf Salad 120g,£0.69,120g,fresh-food
2565,Nature's Pick Rocket & Baby Leaf Salad 90g,£0.79,90g,fresh-food
2566,Macaulay's Scotch Lamb Liver Typically 0.325kg,£1.30,Typically 0.325kg,fresh-food
2567,Nature's Pick Butternut Squash Each,£0.95,Each,fresh-food
2568,Specially Selected Smoked Scottish Back Bacon Rashers 240g/8 Pack,£2.39,240g,fresh-food
2569,Specially Selected Unsmoked Scottish Back Bacon Rashers 240g/8 Pack,£2.39,240g,fresh-food
2570,Nature's Pick XL Ripe And Ready Avocado Each,£1.39,Each,fresh-food
2571,Ashfields Black Pudding Slices 227g/4 Pack,£0.99,227g,fresh-food
2572,Specially Selected Easy Peelers 600g,£1.69,600g,fresh-food
2573,Nature's Pick Beansprouts 400g,£0.75,400g,fresh-food
2574,Nature's Glen Scottish Pork Chops 700g/4 Pack,£3.99,700g,fresh-food
2575,Nature's Pick Oriental Style Stir Fry 320g,£0.89,320g,fresh-food
2576,Nature's Pick Mixed Pepper Stir Fry 320g,£0.89,320g,fresh-food
2577,Macaulay's Smoked Ham Hough 850g,£2.69,850g,fresh-food
2578,Specially Selected Free Range Corn Fed Chicken Thigh Fillets 375g,£3.49,375g,fresh-food
2579,Nature's Glen Chicken Breast Fillets 2kg,£11.99,2kg,fresh-food
2580,Nature's Pick Spring Onions 100g,£0.69,100g,fresh-food
2581,Everyday Essentials Cherries 200g,£1.89,200g,fresh-food
2582,Nature's Pick Rice Noodles 300g,£0.99,300g,fresh-food
2583,Nature's Pick Cucumber Each.,£0.89,Each.,fresh-food
2584,Specially Selected Scottish Pork & Bramley Apple Sausages 400g/6 Pack,£2.49,400g,fresh-food
2585,Specially Selected Sourdough Breaded Wild Garlic & Jersey Butter Chicken Kievs 375g/2 Pack,£3.99,375g,fresh-food
2586,Nature's Pick Large Ripe And Ready Avocado Each,£0.95,Each ,fresh-food
2587,Ashfields Lamb Leg Steaks 300g,£4.19,300g,fresh-food
2588,Ashfields 100% British Lamb Chops 340g,£4.69,340g,fresh-food
2589,Hall's Wee Willie Winkie's 20 Mini Skinless Sausages 20x205g,£1.25,20x205g,fresh-food
2590,Nature's Pick Sweet Mini Peppers 190g,£1.29,190g,fresh-food
2591,Nature's Pick Sweetheart Cabbage Each,£0.69,Each,fresh-food
2592,Nature's Pick Red Seedless Grapes 500g,£1.89,500g,fresh-food
2593,The Fishmonger Boneless Sea Bass Fillets 180g/2 Pack,£2.89,180g,fresh-food
2594,Specially Selected British Free Range Corn Fed Whole Chicken Fresh Class A Without Giblets Typically 1.9kg,£9.48,Typically 1.9kg,fresh-food
2595,The Fishmonger Lemon & Herb Kiln Roasted Salmon Fillets 180g/2 Pack,£3.99,180g,fresh-food
2596,Specially Selected Scottish Cumberland Pork Chipolatas 375g/12 Pack,£2.49,375g,fresh-food
2597,Specially Selected Rich & Spicy Cod & Chorizo Fishcakes 290g/2 Pack,£2.19,290g,fresh-food
2598,Ashfields Half Leg Of Lamb Typically 1.15kg,£13.79,Typically 1.15kg,fresh-food
2599,Ashfields Half Leg Of Lamb Typically 1.275kg,£15.29,Typically 1.275kg,fresh-food
2600,Ashfields 21 Day Matured Beef Roasting Joint Typically 1.025kg,£8.70,Typically 1.025kg,fresh-food
2601,Ashfields 30 Day Matured Beef Roasting Joint Typically 1.025kg,£10.75,Typically 1.025kg,fresh-food
2602,Ashfields British Beef Brisket Typically 0.975kg,£9.25,Typically 0.975kg,fresh-food
2603,Nature's Pick Best Of British Apples 6 Pack,£1.49,6 pack,fresh-food
2604,Everyday Essentials 21 Day Matured Welsh Beef Steak 227g,£2.99,227g,fresh-food
2605,"Ashfields Roast In The Bag Pork, Sage & Onion Stuffed Whole Chicken 1.6kg",£5.49,1.6kg,fresh-food
2606,Ashfields British Lean Pork Fillet Typically 0.55kg,£3.84,Typically 0.55kg,fresh-food
2607,Nature's Pick Singapore Style Noodles 300g,£0.99,300g,fresh-food
2608,Ashfields Chicken Breast Fillets 2kg,£11.99,2kg,fresh-food
2609,Nature's Pick Chinese Leaf Each,£0.99,Each,fresh-food
2610,Ashfields British Extra Lean Diced Steak 350g,£3.99,350g,fresh-food
2611,The Fishmonger Hot Smoked Black Pepper Mackerel Fillet 200g,£2.19,200g,fresh-food
2612,The Fishmonger Smoked Mackerel Fillets 200g,£2.19,200g,fresh-food
2613,Specially Selected British Cumberland Pork Chipolata 375g/12 Pack,£2.49,375g,fresh-food
2614,Nature's Glen Chicken Breast Fillets 650g,£4.69,650g,fresh-food
2615,Macaulay's Mini Breakfast Pack 350g,£1.79,350g,fresh-food
2616,Nature's Glen Diced Chicken Breast 600g,£3.99,600g,fresh-food
2617,Nature's Glen Chicken Breast Mini Fillets 600g,£3.99,600g,fresh-food
2618,Nature's Glen Chicken Wings 1kg,£1.99,1kg,fresh-food
2619,Oakhurst Slow Cooked BBQ Spare Ribs 600g,£4.49,600g,fresh-food
2620,"Ready, Set…Cook! Slow Cooked BBQ Pulled Pork 400g",£3.29,400g,fresh-food
2621,Ashfields 28 Day Matured Welsh Fillet Steak 170g,£5.29,170g,fresh-food
2622,Ashfields Welsh 30 Day Matured Ribeye Steak 227g,£5.29,227g,fresh-food
2623,Ashfields 30 Day Matured Welsh Rump Steak 1 Pack,£4.25,1 Pack,fresh-food
2624,Ashfields 30 Day Matured Welsh Sirloin Steak 277g,£4.99,277g,fresh-food
2625,Ashfields 21 Day Matured Welsh Ribeye Steak 195g,£3.99,195g,fresh-food
2626,Ashfields 21 Day Matured Welsh Rump Steak 232g,£3.49,232g,fresh-food
2627,Ashfields 21 Day Matured Welsh Sirloin Steak 195g,£3.69,195g,fresh-food
2628,Ashfields Welsh Lean Diced Beef 400g,£4.19,400g,fresh-food
2629,The Fishmonger Smoked Salmon Slices 200g,£4.49,200g,fresh-food
2630,The Fishmonger Sweet Mustard & Dill Dressing Flavoured Smoked Salmon 120g,£3.29,120g,fresh-food
2631,The Fishmonger Lemon & Pepper Flavoured Smoked Salmon 100g,£3.29,100g,fresh-food
2632,Nature's Glen Scottish Chicken Drumsticks 1000g,£1.99,1000g,fresh-food
2633,Oakhurst Unsmoked Back Bacon Rashers 360g/10 Pack,£2.29,360g,fresh-food
2634,Oakhurst Smoked Back Bacon Rashers 360g/10 Pack,£2.29,360g,fresh-food
2635,Specially Selected Dry Cured Smoked Back Bacon 240g/8 Pack,£2.39,240g,fresh-food
2636,Specially Selected Dry Cured Unsmoked Back Bacon 240g/8 Pack,£2.39,240g,fresh-food
2637,Edwards 6 Traditional Pork Sausages 400g,£2.75,400g,fresh-food
2638,Ashfields Beef Meatballs 680g/24 Pack,£4.29,680g,fresh-food
2639,Ashfields British Chicken Drumsticks 1kg,£1.99,1kg,fresh-food
2640,Ashfields Chicken Legs 1kg,£2.29,1kg,fresh-food
2641,Ashfields British Chicken Breast Mini Fillets 600g,£3.99,600g,fresh-food
2642,Ashfields British Diced Chicken Breast Fresh Class A 600g,£3.99,600g,fresh-food
2643,Ashfields Chicken Thigh Fillets 600g,£4.19,600g,fresh-food
2644,Ashfields British Chicken Thighs 1kg,£2.99,1kg,fresh-food
2645,Macaulay's Big Breakfast Pack 700g,£2.89,700g,fresh-food
2646,Ashfields British Chicken Breast Mini Fillets 400g,£2.99,400g,fresh-food
2647,Ashfields British Diced Chicken Breast 400g,£2.99,400g,fresh-food
2648,Nature's Pick Herby Baby Potatoes 385g,£0.99,385g,fresh-food
2649,Nature's Pick Broccoli & Cauliflower Florets 400g,£1.29,400g,fresh-food
2650,Nature's Pick British Shredded Kale 200g,£0.85,200g,fresh-food
2651,Nature's Pick Ripe & Ready Conference Pears 4 Pack,£1.79,4 Pack,fresh-food
2652,Nature's Pick Large Oranges 4 Pack,£1.89,4 Pack,fresh-food
2653,Nature's Pick Ripe & Ready Medium Avocado 2 Pack,£1.49,2 Pack,fresh-food
2654,Nature's Pick Parsnips 500g,£0.75,500g,fresh-food
2655,Everyday Essentials Potatoes 2.5kg,£1.49,2.5kg,fresh-food
2656,Nature's Pick Kiwi Fruit 6 Pack,£1.19,6 Pack ,fresh-food
2657,Nature's Pick Asparagus Tips 100g,£1.40,100g,fresh-food
2658,Nature's Pick Garlic 4 Pack,£0.95,4 Pack,fresh-food
2659,Nature's Pick Snack Pack Grapes 170g,£0.85,170G,fresh-food
2660,Organic Bananas 6 Pack,£1.39,6 Pack,fresh-food
2661,Specially Selected Extra Fine Green Beans 200g,£1.29,200g,fresh-food
2662,Nature's Pick Radish 240g,£0.56,240g,fresh-food
2663,Nature's Pick Large Loose Mango Each,£0.95,Each,fresh-food
2664,Nature's Pick Pomegranate Each,£0.99,Each,fresh-food
2665,The Fishmonger Boneless Mediterranean Sea Bass Fillets 180g/2 Pack,£2.89,180g,fresh-food
2666,The Fishmonger Sweet Chilli Infused Salmon Fillets 220g/2 Pack,£3.89,220g,fresh-food
2667,The Fishmonger Korean BBQ Inspired Infused Salmon Fillets 220g/2 Pack,£3.89,220g,fresh-food
2668,Nature's Pick Rte Plums 4 Pack,£1.69,4 pack,fresh-food
2669,Specially Selected 30 Day Matured Aberdeen Angus Beef Fillet Steak 170g,£6.29,170g,fresh-food
2670,Specially Selected 30 Day Matured British Beef Fillet Steak 170g,£6.29,170g,fresh-food
2671,Village Bakery White Tortilla Wraps 8x62g,£0.99,8x62g,bakery
2672,Village Bakery Toastie Thick Sliced White Bread 800g,£0.75,800g,bakery
2673,Specially Selected Brioche Burger Buns 200g/4 Pack,£1.05,200g,bakery
2674,Hovis Soft White Medium 800g,£1.39,800g,bakery
2675,Village Bakery Toasting Waffles 250g/12 Pack,£1.59,250g,bakery
2676,Village Bakery Mini White Tortilla Wraps 8x31g,£0.69,8x31g,bakery
2677,Specially Selected Seeded Brioche Burger Buns 200g/4 Pack,£1.05,200g,bakery
2678,Hovis Soft White Thick 800g,£1.39,800g,bakery
2679,Village Bakery Hot Cross Buns 420g/6 Pack,£1.09,420g,bakery
2680,Village Bakery Original Bagels 425g/5 Pack,£0.75,425g,bakery
2681,Village Bakery Soft Sliced White Sandwich Thins 240g/6 Pack,£0.49,240g,bakery
2682,Village Bakery Brown Sandwich Thins 240g/6 Pack,£0.49,240g,bakery
2683,Village Bakery Both In One Tortilla Wraps 8x62g,£0.99,8x62g,bakery
2684,Hovis Tasty Wholemeal Medium 800g,£1.39,800g,bakery
2685,Bon Appetit! Chocolate Filled Crêpes 180g/6 Pack,£1.39,180g,bakery
2686,Village Bakery Sliced White Hot Dog Rolls 348g/6 Pack,£0.89,348g,bakery
2687,Holly Lane Fruit Tea Loaf 500g,£2.19,500g,bakery
2688,Holly Lane Irish Whiskey Cake 490g,£2.19,490g,bakery
2689,Brownings The Bakers Large Buttermilk Pancakes 4 Pack,£0.89,4 Pack,bakery
2690,Authentic Scottish Bakeries Scotch Pancakes 6x30g,£0.65,6x30g,bakery
2691,Authentic Scottish Bakeries Well Fired Rolls 200g/4 Pack,£0.79,200g,bakery
2692,Village Bakery Soft White Pittas 360g/6 Pack,£0.50,360g,bakery
2693,Village Bakery Wholemeal Pittas 360g/6 Pack,£0.50,360g,bakery
2694,McGregor's Bakehouse Honeycomb Caramel Shortcake 170g,£1.39,170g,bakery
2695,Village Bakery Bake At Home White Dinner Rolls 560g/8 Pack,£1.89,560g,bakery
2696,Village Bakery Bake At Home Seeded Dinner Rolls 560g/8 Pack,£1.89,560g,bakery
2697,Specially Selected Dark Rye Sourdough Loaf 500g,£1.69,500g,bakery
2698,Village Bakery Soft White Large Baps 4 Pack,£0.69,4 Pack,bakery
2699,Village Bakery Soft Wholemeal Large Baps 4 Pack,£0.69,4 Pack,bakery
2700,Mothers Pride Scottish Plain Medium Cut 800g,£1.19,800g,bakery
2701,Brace's Medium White Sliced Bread 800g,£1.39,800g,bakery
2702,Brace's Family Bread Thick White Sliced Bread 800g,£1.39,800g,bakery
2703,The Country Bakehouse Four Eccles Cakes 4 Pack,£1.69,4 pack,bakery
2704,Village Bakery White Rolls 670g/12 Pack,£1.29,670g,bakery
2705,Specially Selected Deliciously Sweet Caramel Crispy Mini Bites 210g,£2.25,210g,bakery
2706,Specially Selected White Sourdough Loaf 500g,£1.69,500g,bakery
2707,Specially Selected Bake At Home Baguettes With Sourdough 250g/2 Pack,£1.29,250g,bakery
2708,Bon Appetit! Pains Au Chocolat 8x45g,£1.29,8x45g,bakery
2709,Bon Appetit! Vanilla Marble Brioche 400g,£2.19,400g,bakery
2710,Bon Appetit! Chocolate Marble Brioche 400g,£2.19,400g,bakery
2711,Bon Appetit! Chocolate Chip Brioche Swirls 6x50g,£1.79,6x50g,bakery
2712,Bon Appetit! Raisin Brioche Swirls 6x50g,£1.79,6x50g,bakery
2713,Bon Appetit! Sliced Brioche Loaf 500g,£1.69,500g,bakery
2714,Village Bakery Mini Blueberry Muffins 380g/16 Pack,£1.75,380g,bakery
2715,Holly Lane Mini Chocolate Chip Muffins 336g/16 Pack,£1.75,336g,bakery
2716,Holly Lane Mini Double Chocolate Muffins 336g/16 Pack,£1.75,336g,bakery
2717,Village Bakery Caramel Shortcake Slices 200g/4 Pack,£1.45,200g,bakery
2718,Village Bakery Iced Belgian Buns 200g/2 Pack,£1.25,200g,bakery
2719,Village Bakery Super Soft Seeded Wraps 8 Pack,£0.99,8 Pack,bakery
2720,Village Bakery Wholemeal Tortilla Wraps 8x62g,£0.99,8x62g,bakery
2721,Specially Selected Rocky Road Mini Bites 220g,£2.25,220g,bakery
2722,Holly Lane Bakewell Slices 175g/6 Pack,£1.05,175g,bakery
2723,Village Bakery Plain Bagel Thins 6 Pack/6 Pack,£1.19,6 pack,bakery
2724,Specially Selected All Butter Scones 260g/4 Pack,£1.59,260g,bakery
2725,Specially Selected Sultana All Butter Scones 300g/4 Pack,£1.59,300g,bakery
2726,Village Bakery White Oven Bottom Muffins 272g/4 Pack,£0.65,272g,bakery
2727,Village Bakery Seeded Sliced Bloomer Bread 800g,£1.39,800g,bakery
2728,Village Bakery Crumpets 336g/6 Pack,£0.45,336g,bakery
2729,Specially Selected Light & Flaky All Butter Croissants 236g/4 Pack,£1.95,236g,bakery
2730,Village Bakery Tiger Bloomer Sliced Bread 800g,£1.39,800g,bakery
2731,Village Bakery Wholemeal Rustic Bloomer Sliced Bread 400g,£0.99,400g,bakery
2732,Village Bakery Medium Sliced White Bread 800g,£0.74,800g,bakery
2733,Village Bakery Soft White Farmhouse Loaf 800g,£0.85,800g,bakery
2734,Village Bakery Classic Sliced Malted Bloomer Loaf 800g,£1.39,800g,bakery
2735,Specially Selected Seeded Sourdough Loaf 500g,£1.69,500g,bakery
2736,Holly Lane Chocolate Chip Cake Bars 130g/5 Pack,£0.75,130g,bakery
2737,Bilash Plain Naan Breads 260g/2 Pack,£0.69,260g,bakery
2738,Inspired Cuisine Garlic & Coriander Naans 260g/2 Pack,£0.69,260g,bakery
2739,Warburtons Medium Soft White 800g,£1.40,800g,bakery
2740,Warburtons Soft Thick White Toastie 800g,£1.40,800g,bakery
2741,Warburtons Toastie Soft Thick White 400g,£0.99,400g,bakery
2742,Warburtons Medium Sliced Wholemeal 400g,£0.99,400g,bakery
2743,Kingsmill 50/50 Medium Bread 800g,£1.30,800g,bakery
2744,Authentic Scottish Bakeries Cherry Scones 280g/4 Pack,£1.09,280g,bakery
2745,Village Bakery Lightly Seeded Loaf 800g,£0.85,800g,bakery
2746,Village Bakery Sesame Bagels 425g/5 Pack,£0.99,425g,bakery
2747,Village Bakery Scottish Plain Bread Medium Cut 800g,£0.99,800g,bakery
2748,Authentic Scottish Bakeries Scottish Plain Thick Cut White Bread 800g,£0.99,800g,bakery
2749,Bon Appetit! Croissants 320g,£1.39,320g,bakery
2750,Authentic Scottish Bakeries Sultana Scones 240g/4 Pack,£0.89,240g,bakery
2751,Authentic Scottish Bakeries Plain Scones 240g/4 Pack,£0.89,240g,bakery
2752,Village Bakery Fruit Loaf 400g,£1.09,400g,bakery
2753,Village Bakery Bake At Home White Baguettes 300g/2 Pack,£0.85,300g,bakery
2754,Village Bakery Scotch Pancakes 192g/6 Pack,£0.49,192g,bakery
2755,Authentic Scottish Bakeries White Sub Rolls 340g/4 Pack,£0.85,340g,bakery
2756,Authentic Scottish Bakeries Wholemeal Sub Rolls 320g/4 Pack,£0.85,320g,bakery
2757,McGregor's Bakehouse Caramel Shortcake 200g,£1.45,200g,bakery
2758,Authentic Scottish Bakeries Scottish Morning Rolls 4 Pack,£0.75,4 Pack,bakery
2759,Authentic Scottish Bakeries Finger Rolls 6 Pack,£0.75,6 Pack,bakery
2760,Village Bakery Splendid Seeds Sliced White Bread 800g,£1.35,800g,bakery
2761,Authentic Scottish Bakeries Potato Scones 6x40g,£0.75,6x40g,bakery
2762,Authentic Scottish Bakeries Buttermilk Soda Farls 180g/2 Pack,£0.99,180g,bakery
2763,Authentic Scottish Bakeries Scottish Butteries 4 Pack,£0.99,4 Pack,bakery
2764,Authentic Scottish Bakeries Large Scottish Crumpets 345g/6 Pack,£0.95,345g,bakery
2765,McGregor's Bakehouse Madeira Cake 320g,£1.35,320g,bakery
2766,McGregor's Bakehouse Sultana Cake 320g,£1.35,320g,bakery
2767,McGregor's Bakehouse Cherry Cake 320g,£1.35,320g,bakery
2768,McGregor's Bakehouse Raspberry Butterfly Cakes 6x35g,£1.39,6x35g,bakery
2769,Authentic Scottish Bakeries Mature Cheddar Cheese Scones 240g/4 Pack,£1.09,240g,bakery
2770,Village Bakery Both In One Sliced Bread 800g,£0.75,800g,bakery
2771,Specially Selected Superseed Farmhouse Sliced White Bread 800g,£1.09,800g,bakery
2772,Bon Appetit! Plain Sugar Waffles 275g/5 Pack,£1.25,275g,bakery
2773,Bon Appetit! Chocolate Sugar Waffles 300g/5 Pack,£1.25,300g,bakery
2774,Village Bakery Medium Sliced Wholemeal Bread 800g,£0.75,800g,bakery
2775,Inspired Cuisine Ciabatta Rolls 360g/4 Pack,£1.19,360g,bakery
2776,Everyday Essentials Medium Sliced White Bread 800g,£0.47,800g,bakery
2777,Everyday Essentials Medium Sliced Wholemeal Bread 800g,£0.47,800g,bakery
2778,Village Bakery Bake At Home White Rolls 300g/4 Pack,£0.85,300g,bakery
2779,Village Bakery Chocolate Flavour Filled Waffles 272g/8 Pack,£1.35,272g,bakery
2780,Holly Lane Triple Chocolate Muffins 4 Pack,£1.35,4 Pack ,bakery
2781,Village Bakery Blueberry Muffins 4 Pack,£1.35,4 Pack,bakery
2782,Dairyfine Chocolate Mini Rolls 260g,£1.29,260g,bakery
2783,Holly Lane Viennese Whirls 165g/6 Pack,£1.09,165g,bakery
2784,Holly Lane Angel Slices 165g/6 Pack,£0.99,165g,bakery
2785,Holly Lane Walnut Cake 306g,£1.39,306g,bakery
2786,Holly Lane Madeira Cake 280g,£1.39,280g,bakery
2787,Holly Lane Angel Cake 250g,£1.39,250g,bakery
2788,Specially Selected Brioche Hot Dog Rolls 270g/6 Pack,£1.39,270g,bakery
2789,Specially Selected Strawberry & Clotted Cream Flavour Swiss Roll 275g,£1.49,275g,bakery
2790,Specially Selected Sicilian Lemon Swiss Roll 275g,£1.49,275g,bakery
2791,Specially Selected Luxury Fruited Hot Cross Buns 260g/4 Pack,£1.49,260g,bakery
2792,Specially Selected Lemon Drizzle Cake 399g,£2.25,399g,bakery
2793,Choceur Milk Chocolate Cake Bars 107g/5 Pack,£0.99,107g,bakery
2794,Specially Selected Victoria Sponge Cake 350g,£2.25,350g,bakery
