,product_name,price,weight,category
1428,Specially Selected All Butter Shortbread Rounds 160g,£1.39,160g,food-cupboard
1429,Specially Selected All Butter Lemon Shortbread Rounds 160g,£1.39,160g,food-cupboard
1430,Specially Selected Belgian Chocolate Chip Shortbread Rounds 160g,£1.39,160g,food-cupboard
1431,Skinny Whip Mint Flavour Bars 5 X 20g,£0.99,5 x 20g,food-cupboard
1432,The Foodie Market Gluten Free Red Lentil & Beetroot Fusilli 250g,£1.29,250g,food-cupboard
1433,The Foodie Market Gluten Free Green Pea Penne 250g,£1.29,250g,food-cupboard
1434,The Foodie Market Gluten Free Chickpea Fusilli 250g,£1.29,250g,food-cupboard
1435,Skinny Whip Orange & Chocolate Flavour Bars 5 X 20g,£0.99,5 x 20g,food-cupboard
1436,The Foodie Market Yogurt Coated Raisins 5x25g,£1.59,5x25g,food-cupboard
1437,Dominion Fruit Pastilles 230g,£0.89,230g,food-cupboard
1438,Duncan's French Onion Soup 400g,£0.99,400g,food-cupboard
1439,Four Seasons Supersweet Sweetcorn In Water 4x200g (4x160g Drained),£1.99,4x200g (4x160g Drained),food-cupboard
1440,Specially Selected Chocolate & Hazelnut All Butter Cookies 200g,£1.69,200g,food-cupboard
1441,The Foodie Market Strawberry Yogurt Bites 5x25g,£1.59,5x25g,food-cupboard
1442,Worldwide Foods Winter Grains 250g,£1.05,250g,food-cupboard
1443,Specially Selected Jalapeno Chilli Jam 340g,£1.79,340g,food-cupboard
1444,"Snackrite Family Snacks 18x18g, 6x17g/24 Pack",£2.49,"18x18g, 6x17g",food-cupboard
1445,Skinny Whip Toffee Flavour 5 X 20g,£0.99,5 x 20g,food-cupboard
1446,Snackrite Saucy Nibbley Nobblies 80g,£0.89,80g,food-cupboard
1447,Bramwells Roasted Vegetable Cous Cous 100g,£0.49,100g,food-cupboard
1448,Bramwells Lemon & Coriander Cous Cous 100g,£0.49,100g,food-cupboard
1449,Bramwells Sundried Tomato & Garlic Cous Cous 100g,£0.49,100g,food-cupboard
1450,Bramwells Moroccan Medley Cous Cous 100g,£0.49,100g,food-cupboard
1451,The Deli Pickled Baby Beetroot 710g (462g Drained),£1.19,710g (462g Drained),food-cupboard
1452,Bramwells Real Mayonnaise 500ml,£0.95,500ml,food-cupboard
1453,Finlays Flamegrilled Aberdeen Angus Flavoured Potato Crisps 150g,£1.15,150g,food-cupboard
1454,Worldwide Foods American Style Buffalo Rice 250g,£0.99,250g,food-cupboard
1455,Worldwide Foods Asian Style Bang Bang Rice 250g,£0.99,250g,food-cupboard
1456,Cucina Chunky Chopped Tomatoes With Herbs In Tomato Juice 400g,£0.59,400g,food-cupboard
1457,Four Seasons Supersweet Sweetcorn In Water 325g (260g Drained),£0.65,325g (260g Drained),food-cupboard
1458,Dairyfine Bubbly Caramel Chocolate 100g,£1.19,100g,food-cupboard
1459,Moser Roth Dark Chocolate Hazelnut Bars 5x25g,£2.15,5x25g,food-cupboard
1460,Dairyfine Giant Chocolate Buttons Orange 120g,£1.19,120g,food-cupboard
1461,Dairyfine Giant Chocolate Buttons Blended 120g,£1.19,120g,food-cupboard
1462,Harvest Morn Peanut Butter Flavour High Protein Bar 3x60g,£3.99,3x60g,food-cupboard
1463,Harvest Morn Cookie Dough Flavour High Protein Bar 3x60g,£3.99,3x60g,food-cupboard
1464,The Foodie Market Smooth Almond Butter 170g,£1.79,170g,food-cupboard
1465,The Foodie Market Crunchy Almond Butter 170g,£1.79,170g,food-cupboard
1466,Weetabix 36 36 Pack,£3.99,36 Pack,food-cupboard
1467,Fishmonger Tuna Chunks In Spring Water 145g (102g Drained),£0.65,145g (102g Drained),food-cupboard
1468,Kellogg's Crunchy Nut 300g,£2.25,300g,food-cupboard
1469,Specially Selected Cherry Tomatoes In Rich Tomato Juice 400g (240g Drained),£0.75,400g (240g Drained),food-cupboard
1470,Cadbury Mini Eggs 97g,£1.65,97g,food-cupboard
1471,Bramwells Cheesy Pasta Pot 70g,£0.89,70g,food-cupboard
1472,Everyday Essentials Roasted Salted Cashews 125g,£0.99,125g,food-cupboard
1473,Snackrite Salt 'N' Vinegar Starry Night Mix 125g,£1.25,125g,food-cupboard
1474,Snackrite Sour Cream & Chive Starry Night Mix 125g,£1.25,125g,food-cupboard
1475,Harvest Morn Craze Milk Chocolate Cereal 375g,£0.89,375g,food-cupboard
1476,Specially Selected Nocciola 150g,£2.99,150g,food-cupboard
1477,Bramwells Cheese Sauce Mix 40g,£0.39,40g,food-cupboard
1478,Bramwells Peppercorn Simmer Sauce Mix 25g,£0.39,25g,food-cupboard
1479,Bramwells Parsley Simmer Sauce Mix 20g,£0.39,20g,food-cupboard
1480,Dairyfine Curious Inventions Milk Chocolate 160g,£1.65,160g,food-cupboard
1481,Dairyfine Curious Inventions White Chocolate 160g,£1.65,160g,food-cupboard
1482,Cucina Mushroom Filled Tortelloni 250g,£1.19,250g,food-cupboard
1483,Snackrite Salt And Vinegar Flavour Tiles 6x22g,£0.79,6x22g,food-cupboard
1484,The Foodie Market Dried Mango 100g,£1.39,100g,food-cupboard
1485,Snackrite BBQ Popouts 5x17g,£1.35,5x17g,food-cupboard
1486,Snackrite Sour Cream Popouts 5x17g,£1.35,5x17g,food-cupboard
1487,Specially Selected Chilli Infused Olive Oil 250ml,£2.39,250ml,food-cupboard
1488,Specially Selected Basil Infused Olive Oil 250ml,£2.39,250ml,food-cupboard
1489,Specially Selected Garlic Infused Olive Oil 250ml,£2.39,250ml,food-cupboard
1490,Harvest Morn Choco Rice Cereal 375g,£0.79,375g,food-cupboard
1491,Belmont Nice Biscuits 200g,£0.49,200g,food-cupboard
1492,Choceur Milk Chocolate Bons 200g,£2.89,200g,food-cupboard
1493,Choceur White Chocolate Bons 200g,£2.89,200g,food-cupboard
1494,Galaxy Ripple Chocolate Bars Multipack 4 X 120.0g,£1.75,4 x 120.0g,food-cupboard
1495,Walkers Wotsits Really Cheesy Multipack Snacks Crisps 12 X 16.5g,£2.99,12 x 16.5g,food-cupboard
1496,Walkers Quavers Cheese Multipack Snacks Crisps 12 X 16g,£2.99,12 x 16g,food-cupboard
1497,M&M's Chocolate Pouch Bag 125.0g,£1.65,125.0g,food-cupboard
1498,Specially Selected Tomato & Mascarpone Stir Through Sauce 190g,£1.49,190g,food-cupboard
1499,Specially Selected Tomato & Olive Stir Through Sauce 190g,£1.49,190g,food-cupboard
1500,Dairyfine Duo Chocolate Flavoured Spread 400g,£1.59,400g,food-cupboard
1501,Dairyfine Milk Chocolate Raisins 180g,£1.09,180g,food-cupboard
1502,Dairyfine Chocolate Coated Peanuts 180g,£1.09,180g,food-cupboard
1503,The Foodie Market Strawberry & Banana Dino Fruit Bars 5x30g,£1.79,5x30g,food-cupboard
1504,Snackrite Strawberry Yogurt Bites 25g,£0.45,25g,food-cupboard
1505,Snackrite Yogurt Coated Raisins 25g,£0.45,25g,food-cupboard
1506,Snackrite Banana Yogurt Bites 25g,£0.45,25g,food-cupboard
1507,Everyday Essentials Lightly Salted Tortilla Chips 200g,£0.57,200g,food-cupboard
1508,Swizzels Squashies Drumstick Sour Cherry & Apple Flavour 140g,£0.99,140g,food-cupboard
1509,Swizzels Squashies Drumstick Original Raspberry & Milk Flavour 140g,£0.99,140g,food-cupboard
1510,Bramwells Reduced Sugar & Salt Tomato Ketchup 530g,£0.89,530g,food-cupboard
1511,Snackrite Salt & Vinegar Roasted Peanuts 25g,£0.42,25g,food-cupboard
1512,Snackrite Fully Loaded Buffalo Wings Roasted Peanuts 25g,£0.42,25g,food-cupboard
1513,Snackrite Fully Loaded Jalapeño Roasted Peanuts 25g,£0.42,25g,food-cupboard
1514,Dominion Fruit Chews Sweets 450g,£2.69,450g,food-cupboard
1515,Specially Selected Creamy & Peppery Peppercorn & Brandy Pour Over Sauce 200g,£1.69,200g,food-cupboard
1516,Specially Selected Sweet & Tart Bramley Apple & Cider Pour Over Sauce 200g,£1.69,200g,food-cupboard
1517,Dominion Strawberry & Peach Flavour Complimints 30g,£0.89,30g,food-cupboard
1518,Specially Selected Luxury Chilli Savoury Crackers 185g,£1.09,185g,food-cupboard
1519,Specially Selected Luxury Sesame & Garlic Crackers 170g,£1.09,170g,food-cupboard
1520,Specially Selected Luxury Beetroot & Seed Savoury Crackers 170g,£1.09,170g,food-cupboard
1521,Solesta Olive Oil 1l,£7.29,1L,food-cupboard
1522,Solesta Light Olive Oil 1l,£7.29,1L,food-cupboard
1523,Dairyfine Milk Chocolate 200g,£1.45,200g,food-cupboard
1524,Dairyfine Dark Chocolate 200g,£1.45,200g,food-cupboard
1525,The Foodie Market Chocolate Fruit & Nut Mix 25g,£0.42,25g,food-cupboard
1526,The Foodie Market Sticky Toffee Mix 25g,£0.42,25g,food-cupboard
1527,The Foodie Market Apricot & Almond Mix 25g,£0.42,25g,food-cupboard
1528,The Foodie Market Cashew & Cranberry Mix 25g,£0.42,25g,food-cupboard
1529,Savour Bakes Wheat Crackers 170g,£0.79,170g,food-cupboard
1530,Savour Bakes Multigrain Crackers 170g,£0.79,170g,food-cupboard
1531,Bramwells Express Pasta With Tomato & Onion Sauce 110g,£0.45,110g,food-cupboard
1532,Skittles Chewies Fruits Sweets Pouch Bag 137.0g,£1.15,137.0g,food-cupboard
1533,Starburst Vegan Chewy Sweets Fruit Flavoured Pouch Bag 138.0g,£1.15,138.0g,food-cupboard
1534,The Pantry Puff Pastry 320g,£0.99,320g,food-cupboard
1535,The Pantry Shortcrust Pastry 320g,£0.99,320g,food-cupboard
1536,The Deli Balsamic Vinegar Of Modena 500ml,£1.59,500ml,food-cupboard
1537,Specially Selected Sweet Beetroot & Red Onion Chutney 310g,£1.79,310g,food-cupboard
1538,Solesta Extra Virgin Olive Oil 1l,£7.59,1L,food-cupboard
1539,The Pantry Rolled Puff Pastry 320g,£0.99,320g,food-cupboard
1540,The Pantry Rolled Shortcrust Pastry 320g,£0.99,320g,food-cupboard
1541,Harvest Morn Choco Pillows 500g,£1.09,500g,food-cupboard
1542,The Foodie Market Yogurt Coated Cranberries 170g,£1.19,170g,food-cupboard
1543,Asia Specialities Sriracha Hot Chilli Sauce 535g,£1.99,535g,food-cupboard
1544,The Fishmonger Tuna Steak In Sunflower Oil 110g,£0.99,110g,food-cupboard
1545,The Fishmonger Tuna Steak In Brine 110g,£0.99,110g,food-cupboard
1546,The Fishmonger Tuna Steak In Spring Water 110g,£0.99,110g,food-cupboard
1547,The Pantry Madagascan Vanilla Extract 38ml,£0.79,38ml,food-cupboard
1548,Cucina Three Cheese Tortelloni 250g,£1.19,250g,food-cupboard
1549,Cucina Spinach & Ricotta Tortelloni 250g,£1.19,250g,food-cupboard
1550,Choceur Dark Hazelnut Chocolate 100g,£1.29,100g,food-cupboard
1551,Specially Selected Garlic Passata Rustica 690g,£1.85,690g,food-cupboard
1552,Specially Selected Basil & Oregano Passata Rustica 690g,£1.85,690g,food-cupboard
1553,Millions Strawberry 45g,£0.49,45g,food-cupboard
1554,Walkers Classic Pack 12 X 25g,£2.99,12 x 25g,food-cupboard
1555,Bramwells Tomato Ketchup 50% Less Salt & Sugar 535g,£0.89,535g,food-cupboard
1556,Dominion Flix 'N' Mix 340g,£1.35,340g,food-cupboard
1557,Grandessa Smooth Peanut Butter 1kg,£3.99,1kg,food-cupboard
1558,Grandessa Crunchy Peanut Butter 1kg,£3.99,1kg,food-cupboard
1559,Dairyfine Munchy Peanut Cereal Bars 5x32g,£0.99,5x32g,food-cupboard
1560,Dairyfine Munchy Chocolate & Raisin Cereal Bars 5x32g,£0.99,5x32g,food-cupboard
1561,Dairyfine Choc Chip Munchy Cereal Bars 5x32g,£0.99,5x32g,food-cupboard
1562,Harvest Morn Chocolate Peanut & Caramel Flavour Protein Bar 55g,£1.29,55g,food-cupboard
1563,Harvest Morn Chocolate Salted Caramel Flavour Protein Bar 55g,£1.29,55g,food-cupboard
1564,"Snickers Caramel, Nougat, Peanuts & Milk Chocolate Snack Bars Multipack 4 X 166.8g",£1.69,4 x 166.8g,food-cupboard
1565,"Mars Caramel, Nougat & Milk Chocolate Bars Multipack 4 X 157.6g",£1.69,4 x 157.6g,food-cupboard
1566,The Deli Black Pitted Olives 330g (165g Drained),£0.89,330g (165g Drained),food-cupboard
1567,The Deli Green Pitted Olives 340g (165g Drained),£0.89,340g (165g Drained),food-cupboard
1568,Dairy Fine Raisin Munchy Cereal Bars 5x32g,£0.99,5x32g,food-cupboard
1569,Dairy Fine Peanut Munchy Cereal Bars 5x32g,£0.99,5x32g,food-cupboard
1570,Dairy Fine Choc Chips Munchy Cereal Bars 5x32g,£0.99,5x32g,food-cupboard
1571,Solesta Oil Olive 1l,£3.10,1L,food-cupboard
1572,Solesta Light In Colour Olive Oil 1l,£3.10,1L,food-cupboard
1573,Skittles Vegan Chewy Sweets Fruit Flavoured Pouch Bag 136.0g,£1.15,136.0g,food-cupboard
1574,The Pantry Walnut Pieces 150g,£0.99,150g,food-cupboard
1575,The Pantry Pecan Halves 100g,£0.99,100g,food-cupboard
1576,Specially Selected Egg Tagliatelle Pasta 500g,£1.39,500g,food-cupboard
1577,The Foodie Market Blackcurrant Dinos 5x20g,£1.69,5x20g,food-cupboard
1578,Worldwide Foods Basmati Rice 1kg,£1.85,1kg,food-cupboard
1579,Bramwells Chunky Lamb Soup 400g,£0.99,400g,food-cupboard
1580,The Deli Pitted Green Olives 340g (165g Drained),£0.89,340g (165g Drained),food-cupboard
1581,Harvest Morn Bran Flakes 750g,£0.99,750g,food-cupboard
1582,Harvest Morn Chocolate Peanut & Caramel Flavour Vitamin & Protein Bar 3x40g,£2.99,3x40g,food-cupboard
1583,Harvest Morn Chocolate Salted Caramel Flavour Vitamin & Protein Bar 3x40g,£2.99,3x40g,food-cupboard
1584,Snackrite Prawn Cocktail Crisps 6x25g,£0.89,6x25g,food-cupboard
1585,Duncan's Selections Garden Vegetable Soup 400g,£0.99,400g,food-cupboard
1586,Bramwells Spaghetti Loops 400g,£0.35,400g,food-cupboard
1587,Specially Selected Butternut Squash & Prosciutto Soup 400g,£1.15,400g,food-cupboard
1588,Dairyfine Wholenut Milk Chocolate 200g,£1.45,200g,food-cupboard
1589,Dairyfine Fruit & Nut Milk Chocolate 200g,£1.45,200g,food-cupboard
1590,"Ready, Set…Cook! Italian Mixed Herbs 13g",£0.69,13g,food-cupboard
1591,Dairyfine Peanut Choc Um's 140g,£1.35,140g,food-cupboard
1592,Harvest Morn Strawberry Top Twists 4x70g,£1.65,4x70g,food-cupboard
1593,Harvest Morn Chocolate Top Twists 4x70g,£1.65,4x70g,food-cupboard
1594,Everyday Essentials Red Kidney Beans In Water 400g (240g Drained),£0.33,400g (240g Drained),food-cupboard
1595,The Foodie Market Hand Popped Popcorn 27g,£0.49,27g,food-cupboard
1596,Werther's Original Butter Candies 135g,£1.19,135g,food-cupboard
1597,Werther's Original Creamy Filling 125g,£1.19,125g,food-cupboard
1598,Four Seasons Fruit Cocktail In Juice 411g (250g Drained),£0.99,411g (250g Drained),food-cupboard
1599,Werther's Original Sugar Free Butter Candies 80g,£1.19,80g,food-cupboard
1600,Snackrite Chilli Rice Crackers 85g,£0.79,85g,food-cupboard
1601,Snackrite Wasabi Snack Mix 85g,£0.79,85g,food-cupboard
1602,"Ready, Set…Cook! Harissa 43g",£0.89,43g,food-cupboard
1603,The Foodie Market Banana Chips 230g,£1.39,230g,food-cupboard
1604,Bramwells Chunky Salsa Topping 280g,£1.25,280g,food-cupboard
1605,Bramwells Soured Cream Topping 280g,£1.25,280g,food-cupboard
1606,Bramwells Chunky Guacamole Topping 280g,£1.25,280g,food-cupboard
1607,"Ready, Set…Cook! Onion Granules 36g",£0.65,36g,food-cupboard
1608,Snackrite Salt & Vinegar Peanuts 200g,£1.25,200g,food-cupboard
1609,Mcvitie's 7 Gold Bars 124g,£1.49,124g,food-cupboard
1610,Everyday Essentials Plain Flour 1.5kg,£0.75,1.5kg,food-cupboard
1611,Everyday Essentials Self Raising Flour 1.5kg,£0.75,1.5kg,food-cupboard
1612,Bramwells Salt & Pepper Seasoning 35g,£0.59,35g,food-cupboard
1613,Snackrite Flame Grilled Steak Flavour Thick Cut Ridged Crisps 150g,£1.09,150g,food-cupboard
1614,Snackrite Thick Cut Ridged Thai Sweet Chicken Flavour Crisps 150g,£1.09,150g,food-cupboard
1615,Dairyfine Milk Chocolate Deeno The Dinosaur 10x18g,£1.99,10x18g,food-cupboard
1616,Mini Cheddars Jacob's Original 14 X Pack,£2.75,14 x Pack,food-cupboard
1617,Make In Minutes Spice Infusion Cous Cous 100g,£0.49,100g,food-cupboard
1618,Everyday Essentials Chocolate Hazelnut Spread 400g,£1.15,400g,food-cupboard
1619,Cucina Tomato Passata 500g,£0.55,500g,food-cupboard
1620,The Foodie Market Roasted Pistachios 200g,£1.65,200g,food-cupboard
1621,Savour Bakes Cream Crackers 300g,£0.49,300g,food-cupboard
1622,Dominion Mini Fruit Gems 200g,£0.85,200g,food-cupboard
1623,The Deli Pickled Pink Onions 340g (156g Drained),£0.99,340g (156g Drained),food-cupboard
1624,Snackrite Roasted & Salted Pistachios 200g,£1.99,200g,food-cupboard
1625,Bramwells Thousand Island Dressing 250ml,£0.79,250ml,food-cupboard
1626,Heinz Tomato Ketchup 650g,£3.39,650g,food-cupboard
1627,Heinz 50% Less Sugar & Salt Tomato Ketchup 625g,£3.39,625g,food-cupboard
1628,Grandessa Squeezy Honey 340g,£1.09,340g,food-cupboard
1629,The Fishmonger Tuna Chunks In Spring Water 145g (102g Drained),£0.65,145g (102g Drained),food-cupboard
1630,Snackrite Roast Chicken & Thyme Perfections 150g,£1.25,150g,food-cupboard
1631,Snackrite Thai Sweet Chilli Perfections 150g,£1.25,150g,food-cupboard
1632,Bramwells Lentil Soup 400g,£0.62,400g,food-cupboard
1633,Bramwells Pea & Ham Soup 400g,£0.62,400g,food-cupboard
1634,Harvest Morn Birthday Cake Fibre Now Bars 5x24g,£1.15,5x24g,food-cupboard
1635,Harvest Morn Instant Oats Mixed Berry Flavour 57g,£0.39,57g,food-cupboard
1636,Belmont Raspberry Jam & Vanilla Cream Biscuits 150g,£0.49,150g,food-cupboard
1637,The Fishmonger Tuna Chunks In Brine 145g (102g Drained),£0.65,145g (102g Drained),food-cupboard
1638,The Pantry Mincemeat 822g,£0.29,822g,food-cupboard
1639,The Fishmonger Anchovy Fillets In Olive Oil 50g (30g Drained),£0.65,50g (30g Drained),food-cupboard
1640,The Pantry Cornflour 500g,£1.69,500g,food-cupboard
1641,Mcvitie's Club Orange (154g) 7 X 22g,£1.49,7 x 22g,food-cupboard
1642,Heinz Cream Of Chicken Soup 4 X 400g,£3.75,4 x 400g,food-cupboard
1643,The Foodie Market Raspberry Dinos 20g,£0.33,20g,food-cupboard
1644,The Foodie Market Strawberry Dinos 20g,£0.33,20g,food-cupboard
1645,Harvest Morn Instant Oats Sweet Cinnamon Flavour 57g,£0.39,57g,food-cupboard
1646,Specially Selected Black Cherry Conserve 340g,£1.45,340g,food-cupboard
1647,Specially Selected Damson Plum Conserve 340g,£1.45,340g,food-cupboard
1648,Everyday Essentials Peach Slices In A Light Syrup 411g (250g Drained),£0.34,411g (250g Drained),food-cupboard
1649,"Ready, Set…Cook! Mild Curry Powder 85g",£0.75,85g,food-cupboard
1650,"Ready, Set…Cook! Garam Masala 85g",£0.75,85g,food-cupboard
1651,The Foodie Market Strawberry Dinos 5x20g,£1.69,5x20g,food-cupboard
1652,Everyday Essentials Roasted & Salted Peanuts 200g,£0.54,200g,food-cupboard
1653,Cucina Macaroni Pasta 500g,£0.72,500g,food-cupboard
1654,The Deli Grilled Artichokes 280g (170 G Drained),£1.59,280g (170 g Drained),food-cupboard
1655,Harvest Morn Cookie Dough Flavour High Protein Bar 60g,£0.79,60g,food-cupboard
1656,Harvest Morn Protein Oats Golden Syrup Flavour 70g,£0.69,70g,food-cupboard
1657,Harvest Morn Protein Oats Chocolate 70g,£0.69,70g,food-cupboard
1658,Savour Bakes Garlic & Herb Cracker Sharing Tub 250g,£0.99,250g,food-cupboard
1659,Savour Bakes Cheese Crackers Sharing Tub 250g,£0.99,250g,food-cupboard
1660,The Foodie Market Raspberry Dinos 5x20g,£1.69,5x20g,food-cupboard
1661,Dairyfine Jive Bar 12 Pack,£1.45,12 pack,food-cupboard
1662,Dairyfine Romeo 4 Pack,£1.19,4 Pack,food-cupboard
1663,Bramwells Minced Beef & Onion 400g,£1.85,400g,food-cupboard
1664,Belmont Multipack Safari Snacks 7x19g,£1.15,7x19g,food-cupboard
1665,Everyday Essentials Long Grain Rice 1kg,£0.52,1kg,food-cupboard
1666,Asia Specialities Teriyaki Stir Fry Sauce 120g,£0.55,120g,food-cupboard
1667,Snackrite BBQ Lentil Chips 6x15g,£1.49,6x15g,food-cupboard
1668,Snackrite Sea Salt Lentil Chips 6x15g,£1.49,6x15g,food-cupboard
1669,Maltesers Milk Chocolate & Honeycomb Bites Bag Fairtrade 102.0g,£1.65,102.0g,food-cupboard
1670,Everyday Essentials Tuna Chunks In Brine 145g (102g Drained),£0.55,145g (102g Drained),food-cupboard
1671,The Pantry Pink & White Mini Marshmallows 180g,£1.35,180g,food-cupboard
1672,Galaxy Minstrels Milk Chocolate Buttons Pouch Bag 125g,£1.65,125g,food-cupboard
1673,"Revels Milk Chocolate With Raisins, Coffee Or Orange Bites Pouch Bag 112.0g",£1.65,112.0g,food-cupboard
1674,Snackrite BBQ Lentil Chips 85g,£1.15,85g,food-cupboard
1675,Snackrite Sea Salt Lentil Chips 85g,£1.15,85g,food-cupboard
1676,Harvest Morn Crunchy Oats & Dark Chocolate Granola Bars 5x42g,£1.25,5x42g,food-cupboard
1677,Four Seasons Chickpeas In Water 400g (240g Drained),£0.49,400g (240g Drained),food-cupboard
1678,Harvest Morn Blueberry Fruit & Grain Bars 6x37g,£1.05,6x37g,food-cupboard
1679,The Foodie Market Walnut Halves 200g,£1.75,200g,food-cupboard
1680,The Foodie Market Cashew Nuts 200g,£1.75,200g,food-cupboard
1681,The Foodie Market Whole Almonds 200g,£1.69,200g,food-cupboard
1682,The Pantry Milk Chocolate Chips 100g,£0.89,100g,food-cupboard
1683,The Pantry Dark Chocolate Chips 100g,£0.89,100g,food-cupboard
1684,The Pantry White Chocolate Chips 100g,£0.89,100g,food-cupboard
1685,Four Seasons Supersweet Sweetcorn In Water 340g (285g Drained),£0.65,340g (285g Drained),food-cupboard
1686,The Fishmonger Tuna Chunks In Sunflower Oil 145g (102g Drained),£0.69,145g (102g Drained),food-cupboard
1687,Cucina Wholewheat Fusilli 500g,£0.75,500g,food-cupboard
1688,Cucina Wholewheat Spaghetti Pasta 500g,£0.75,500g,food-cupboard
1689,Four Seasons Supersweet Sweetcorn In Water 4x198g (4x165g Drained),£1.99,4x198g (4x165g Drained),food-cupboard
1690,Grandessa Strawberry Jam 454g,£0.89,454g,food-cupboard
1691,Grandessa Seedless Raspberry Jam 454g,£0.89,454g,food-cupboard
1692,Cucina Chunky Chopped Tomatoes In A Rich Tomato Juice 400g,£0.47,400g,food-cupboard
1693,Specially Selected Sea Salt & Lime Tortilla Chips 40g,£0.49,40g,food-cupboard
1694,Cucina Peeled Plum Tomatoes In A Rich Tomato Juice 400g,£0.47,400g,food-cupboard
1695,Choceur Milk Chocolate Smooth Praline 40g,£2.85,40g,food-cupboard
1696,The Pantry Strong White Bread Flour 1.5kg,£1.09,1.5kg,food-cupboard
1697,Foodie Market Roasted Pistachios 200g,£1.65,200g,food-cupboard
1698,Bramwells Skeeter's Smokey Chipotle BBQ Sauce 350ml,£1.59,350ml,food-cupboard
1699,Four Seasons Small New Potatoes In Water 560g (345g Drained),£0.79,560g (345g Drained),food-cupboard
1700,Savour Bakes Thins Rosemary & Sea Salt Flatbreads 125g,£1.19,125g,food-cupboard
1701,Quixo Dumpling Mix 142g,£0.69,142g,food-cupboard
1702,Dessert Menu Raspberry Flavour Jelly 135g,£0.85,135g,food-cupboard
1703,Dessert Menu Strawberry Flavour Jelly 135g,£0.85,135g,food-cupboard
1704,Asia Specialities Ready To Wok Medium Noodles 2x150g,£0.85,2x150g,food-cupboard
1705,Snackrite Fully Loaded Jalapeño Peanuts 200g,£1.25,200g,food-cupboard
1706,Snackrite Fully Loaded Buffalo Wings Peanuts 200g,£1.25,200g,food-cupboard
1707,Specially Selected Orange Blossom Honey 340g,£2.49,340g,food-cupboard
1708,Specially Selected Spanish Forest Honey 340g,£2.49,340g,food-cupboard
1709,Knoppers Milk Hazelnut Wafer 100g,£1.29,100g,food-cupboard
1710,Dessert Menu Orange Flavour Jelly 135g,£0.85,135g,food-cupboard
1711,The Pantry Aspartame Sweetener Tablets 300 Pack,£0.65,300 Pack,food-cupboard
1712,Asia Specialities Sweet Chilli Rice Crackers 100g,£0.79,100g,food-cupboard
1713,Specially Selected Hickory Smoked Mixed Nuts 150g,£1.49,150g,food-cupboard
1714,Specially Selected Garlic & Chilli Mixed Nuts 150g,£1.49,150g,food-cupboard
1715,Harvest Morn Choco Rice 375g,£0.79,375g,food-cupboard
1716,Asia Specialities Lightly Salted Rice Crackers 100g,£0.79,100g,food-cupboard
1717,Kinder Medium Chocolate Bars (126g) 6x21g,£1.59,6x21g,food-cupboard
1718,Specially Selected Pink Himalayan Rock Salt 110g,£1.99,110g,food-cupboard
1719,Specially Selected Rainbow Peppercorns 40g,£1.99,40g,food-cupboard
1720,Specially Selected Tomato & Mascarpone Stir Through Pasta Sauce 190g,£1.49,190g,food-cupboard
1721,Specially Selected Tomato & Grilled Peppers Stir Through Pasta Sauce 190g,£1.49,190g,food-cupboard
1722,Harvest Morn Multigrain Dino Shapes 350g,£1.59,350g,food-cupboard
1723,Everyday Essentials Fruit & Nut Mix 200g,£0.59,200g,food-cupboard
1724,Specially Selected Tomato & Olive Stir Through Pasta Sauce 190g,£1.49,190g,food-cupboard
1725,Four Seasons Fruit Cocktail In Syrup 411g (250g Drained),£0.99,411g (250g Drained),food-cupboard
1726,Worldwide Foods Heat & Eat Pesto Style Pasta 200g,£1.05,200g,food-cupboard
1727,Cucina Fusilli Pasta 1kg,£1.29,1kg,food-cupboard
1728,Worldwide Foods Heat & Eat Tomato & Basil Fusilli Pasta 200g,£1.05,200g,food-cupboard
1729,Worldwide Foods Heat & Eat Mac & Cheese Pasta 200g,£1.05,200g,food-cupboard
1730,Everyday Essentials Peeled Potatoes In Water 560g (354g Drained),£0.38,560g (354g Drained),food-cupboard
1731,Finlays Pickled Onion Flavoured Potato Crisps 150g,£1.15,150g,food-cupboard
1732,The Pantry Ground Almonds 150g,£0.99,150g,food-cupboard
1733,The Pantry Flaked Almonds 150g,£0.99,150g,food-cupboard
1734,Harvest Morn Honey Nut Crunchy Cluster Cereal 500g,£1.79,500g,food-cupboard
1735,Harvest Morn Honey Nut Chocolate Crunchy Cluster 500g,£1.79,500g,food-cupboard
1736,Simmers Abernethy 250g,£0.59,250g,food-cupboard
1737,Extra White Bubblemint Sugarfree Chewing Gum Bottle 64g,£1.99,64g,food-cupboard
1738,Snackrite Salted Peanuts & Cashews 150g,£1.35,150g,food-cupboard
1739,The Pantry Aspartame Granulated Sweetener 75g,£0.89,75g,food-cupboard
1740,Snackrite Roasted & Salted Mixed Nuts 150g,£1.35,150g,food-cupboard
1741,Snackrite Roasted & Salted Peanuts & Cashews 150g,£1.35,150g,food-cupboard
1742,Dominion Complimints Sugar Free Spearmint Mints 30g/60 Pack,£0.89,30g,food-cupboard
1743,Dominion Complimints Sugar Free Peppermint Mints 30g/60 Pack,£0.89,30g,food-cupboard
1744,Dominion Complimints Sugar Free Strong Mints 30g,£0.89,30g,food-cupboard
1745,Worldwide Foods Special Mixed Pepper Rice 250g,£0.99,250g,food-cupboard
1746,Harvest Morn Wheat Bisks Chocolate Chip Crispy Bites Cereal 530g,£1.99,530g,food-cupboard
1747,Heinz Cream Of Tomato Soup 4 X 400g,£3.75,4 x 400g,food-cupboard
1748,Bramwells Squeezy Real Mayonnaise 500ml,£0.95,500ml,food-cupboard
1749,The Foodie Market Flaxseed 200g,£1.39,200g,food-cupboard
1750,The Fishmonger Tuna Chunks In Brine 4x145g (4x102g Drained),£2.59,4x145g (4x102g Drained),food-cupboard
1751,Asia Specialities Chinese Style Curry Cooking Sauce 500g,£0.99,500g,food-cupboard
1752,Four Seasons Fruit Cocktail In Light Syrup 411g (250g Drained),£0.99,411g (250g Drained),food-cupboard
1753,Bramwells Mild Chilli Con Carne Cooking Sauce 500g,£0.99,500g,food-cupboard
1754,Cadbury Double Decker Chocolate Bar 4 Pack 4x37.3g,£1.35,4x37.3g,food-cupboard
1755,Belmont Take Away Milk Chocolate Biscuits 135g,£1.29,135g,food-cupboard
1756,Snackrite Mini Poppadoms 85g,£1.19,85g,food-cupboard
1757,"Ready, Set…Cook! Sesame Teriyaki Noodle Meal Kit 352g",£1.99,352g,food-cupboard
1758,"Ready, Set…Cook! Massaman Curry Meal Kit 272g",£1.99,272g,food-cupboard
1759,"Ready, Set…Cook! Khao Soi Meal Kit 262g",£1.99,262g,food-cupboard
1760,Snackrite Popcorn Sweet 110g,£0.99,110g,food-cupboard
