,product_name,price,weight,category
3474,Specially Selected Spicy Salami & Chilli Jam Wood Fired Sourdough Pizza 206g,£2.69,206g,chilled-food
3475,Gastro By Specially Selected Lasagne Al Forno 400g,£3.45,400g,chilled-food
3476,Gastro By Specially Selected Lasagne Al Forno 700g,£4.79,700g,chilled-food
3477,Cucina Spaghetti & Meatballs 400g,£2.49,400g,chilled-food
3478,Cucina Chicken Arrabbiata 400g,£2.49,400g,chilled-food
3479,Cucina Ham & Mushroom Tagliatelle 400g,£2.49,400g,chilled-food
3480,Cucina Tuna Pasta Bake 400g,£2.49,400g,chilled-food
3481,Cucina Beef Lasagne 400g,£2.49,400g,chilled-food
3482,Cucina Macaroni Cheese 400g,£2.49,400g,chilled-food
3483,Cucina Spaghetti Bolognese 400g,£2.49,400g,chilled-food
3484,Brooklea Gooseberry Thick & Creamy Yogurt 4x125g,£1.59,4x125g,chilled-food
3485,Ashfields Dry Cured British Treacle & Ale Ham 120g,£1.49,120g,chilled-food
3486,Brooklea Protein Mousse White Chocolate Flavour 200g,£1.29,200g,chilled-food
3487,Ashfields Wafer Thin British Roast Chicken 400g,£2.29,400g,chilled-food
3488,Dairy Fine Milk Chocolate Pots Of Choc 350g,£1.29,350g,chilled-food
3489,Dairyfine Orange Pots Of Choc 350g,£1.29,350g,chilled-food
3490,Specially Selected Classic Edition Macarons 72g/6 Pack,£1.99,72g,chilled-food
3491,Specially Selected Mushroom & Pecorino Spiralli Pasta Salad 180g,£1.59,180g,chilled-food
3492,Specially Selected Gastro Mac & Cheese 400g,£2.99,400g,chilled-food
3493,Gastro By Ss Chorizo Mac & Cheese 400g,£2.99,400g,chilled-food
3494,Cucina Sausage Pasta Bake 400g,£2.49,400g,chilled-food
3495,Cucina Creamy Chicken & Pesto Style Pasta 400g,£2.49,400g,chilled-food
3496,Crestwood Chilli Con Carne 400g,£2.49,400g,chilled-food
3497,Crestwood Swedish Style Meatballs & Mash 400g,£2.49,400g,chilled-food
3498,Specially Selected Moroccan Style Vegetable Soup 600g,£2.29,600g,chilled-food
3499,Cucina Spaghetti Carbonara 400g,£2.49,400g,chilled-food
3500,Cucina Chicken & Bacon Pasta Bake 400g,£2.49,400g,chilled-food
3501,Cucina Tomato & Mozzarella Pasta Bake 400g,£2.49,400g,chilled-food
3502,Cucina Spinach & Ricotta Cannelloni 400g,£2.49,400g,chilled-food
3503,Gastro Spaghetti Carbonara 400g,£3.49,400g,chilled-food
3504,Gastro Spinach & Ricotta Mezzaluna 400g,£3.49,400g,chilled-food
3505,Cucina Carbonara Pasta Bake 1.2kg,£4.99,1.2kg,chilled-food
3506,"Cucina Chicken, Tomato & Pesto Pasta Bake 1.2kg",£4.99,1.2kg,chilled-food
3507,Carlos Large Stonebaked Margherita Pizza 493g,£2.99,493g,chilled-food
3508,Specially Selected Caramelised Biscuit Crumb Topped Cheesecakes 2x85g,£2.99,2x85g,chilled-food
3509,Crestwood Puff Pastry Topped Steak Pie 500g,£2.79,500g,chilled-food
3510,Crestwood Puff Pastry Topped Chicken & Gravy Pie 500g,£2.79,500g,chilled-food
3511,The Deli Chicken & Sweetcorn Deli Filler 220g,£1.49,220g,chilled-food
3512,Specially Selected Gastro Potato Dauphinoise 400g,£1.99,400g,chilled-food
3513,Gastro By Specially Selected Chicken Kiev Bake 400g,£3.39,400g,chilled-food
3514,Gastro By Specially Selected Chicken & Pancetta Bake 400g,£3.39,400g,chilled-food
3515,"Ready, Set...Cook! Belgian Milk Chocolate Cookie Dough 300g",£1.79,300g,chilled-food
3516,Eat & Go Satay Chicken Skewers 300g/30 Pack*,£3.99,300g,chilled-food
3517,Crestwood Beef & Vegetable Pasties 520g/4 Pack,£1.99,520g,chilled-food
3518,Crestwood Cheese & Onion Pasties 520g/4 Pack,£1.99,520g,chilled-food
3519,Dessert Menu Triple Chocolate Brownie Pudding 200g,£1.75,200g,chilled-food
3520,Dessert Menu Triple Chocolate Cookie Dough Pudding 200g,£1.75,200g,chilled-food
3521,Eat & Go Classic Salami Snacks 40g/8 Pack*,£0.99,40g,chilled-food
3522,Crestwood Hunters Chicken Pie For One 170g,£1.39,170g,chilled-food
3523,Crestwood Sausage & Onion Pie For One 170g,£1.39,170g,chilled-food
3524,Specially Selected Smoky Chilli & Honey Baking Camembert 290g,£3.29,290g,chilled-food
3525,Crestwood Fish Pie 400g,£2.49,400g,chilled-food
3526,Eat & Go Chilli Salami Snacks 40g/8 Pack*,£0.99,40g,chilled-food
3527,Specially Selected Gastro Mashed Potato 400g,£1.39,400g,chilled-food
3528,Crestwood Ready To Eat Puff Pastry Cheese & Onion Slices 300g/2 Pack,£1.75,300g,chilled-food
3529,Crestwood Ready To Eat Puff Pastry Ham & Cheese Slices 300g/2 Pack,£1.75,300g,chilled-food
3530,Crestwood Ready To Eat Puff Pastry Cheesy Bean Slices 300g/2 Pack,£1.75,300g,chilled-food
3531,Quicksters Flame Grilled Beef Burger With Ketchup 115g,£0.99,115g,chilled-food
3532,Brooklea Protein Pudding White Chocolate Flavour 200g,£0.99,200g,chilled-food
3533,Specially Selected Thai Chicken Soup 600g,£2.29,600g,chilled-food
3534,"Crestwood Cauliflower, Broccoli & Cheese Pie For One 170g",£1.39,170g,chilled-food
3535,Delamere Roast Whole Chicken 0.82kg-1.08kg,£4.99,0.82kg-1.08kg,chilled-food
3536,Specially Selected Mezzelune With Prosciutto Di Parma & Parmigiano Reggiano Pasta 250g,£2.29,250g,chilled-food
3537,Specially Selected Chocolate Edition Macarons 72g/6 Pack,£1.99,72g,chilled-food
3538,The Deli Pork & Apple Pâté 170g,£0.99,170g,chilled-food
3539,Cucina Beef Lasagne 1kg,£3.99,1kg,chilled-food
3540,Acti Leaf Chilled Almond Drink No Sugars 1l,£0.99,1L,chilled-food
3541,Acti Leaf Chilled Soya Drink No Sugars 1l,£0.99,1L,chilled-food
3542,Acti Leaf Chilled Oat Drink No Added Sugar 1l,£1.09,1L,chilled-food
3543,Specially Selected Wood Fired Katsu Inspired Chicken Pizza 490g,£3.79,490g,chilled-food
3544,Cowbelle Sterilised Whole Milk 1l,£1.19,1L,chilled-food
3545,Specially Selected Blonde Chocolate & Salted Fudge Cheesecake Slices 2x90g,£2.35,2x90g,chilled-food
3546,Crestwood Scotch Eggs 226g/2 Pack,£1.09,226g,chilled-food
3547,Brooklea Yogurt & Fruit Split Pots With Cherry Compote 136g,£2.19,136g,chilled-food
3548,Cathedral City Our Extra Mature Cheddar 350g,£3.25,350g,chilled-food
3549,Cathedral City Mature Cheddar 350g,£3.25,350g,chilled-food
3550,Emporium Breaded Mozzarella Sticks 240g/12 Pack,£2.49,240g,chilled-food
3551,Crestwood Ready To Eat Puff Pastry Snack Sausage Rolls 270g/9 Pack,£1.19,270g,chilled-food
3552,Inspired Cuisine Chicken Filled Yorkshire Pudding 380g,£2.69,380g,chilled-food
3553,Inspired Cuisine Corned Beef Hash 400g,£2.49,400g,chilled-food
3554,The Deli German Unsmoked Brunswick Ham 100g,£1.19,100g,chilled-food
3555,Specially Selected Long Clawson Shropshire Blue 200g,£2.75,200g,chilled-food
3556,Specially Selected Long Clawson Mature Blue Stilton 220g,£2.75,220g,chilled-food
3557,Specially Selected West Country Farmhouse Mature Barber's Cheddar 350g,£2.99,350g,chilled-food
3558,Specially Selected West Country Farmhouse Extra Mature Barber's Cheddar 350g,£2.99,350g,chilled-food
3559,Specially Selected West Country Mature Cheddar 350g,£2.99,350g,chilled-food
3560,Specially Selected Shropshire Blue Cheese 200g,£2.75,200g,chilled-food
3561,Carlos Takeaway Mac & Cheese Bites 200g,£1.99,200g,chilled-food
3562,Specially Selected Gastro Rich & Creamy Ham Hough Macaroni Cheese 400g,£2.99,400g,chilled-food
3563,Specially Selected Gastro Rich & Indulgent Four Cheese Macaroni 400g,£2.99,400g,chilled-food
3564,Seriously Original 110g,£1.29,110g,chilled-food
3565,Seriously Lighter 110g,£1.29,110g,chilled-food
3566,Frasers Macaroni Pies 2x136g/2 Pack,£1.39,2x136g,chilled-food
3567,Frasers Macaroni Bakes 2x136g/2 Pack,£1.75,2x136g,chilled-food
3568,Frasers Chicken Curry Bakes 2x136g/2 Pack,£1.75,2x136g,chilled-food
3569,Frasers Cheesy Bean Bakes 2x136g/2 Pack,£1.75,2x136g,chilled-food
3570,Frasers Cheese & Onion Bakes 2x136g/2 Pack,£1.75,2x136g,chilled-food
3571,Ashfields British Breaded Ham 300g/14 Pack,£1.69,300g,chilled-food
3572,Specially Selected Gastro Smoked Haddock Gratin 400g,£2.99,400g,chilled-food
3573,Specially Selected Gastro Chicken Balmoral 400g,£2.99,400g,chilled-food
3574,Specially Selected Scottish Roast Pork Slices 120g,£1.99,120g,chilled-food
3575,Everyday Essentials Roast Chicken Breast Fillets 235g,£2.19,235g,chilled-food
3576,Specially Selected Cheese & Caramelised Onion Rolls 188g/4 Pack,£2.39,188g,chilled-food
3577,McCallums Scottish Skimmed Milk <0.5% Fat 4 Pints/2.27l,£1.45,4 Pints,chilled-food
3578,Specially Selected Scottish Arran Mustard Ham Slices 120g,£1.99,120g,chilled-food
3579,Specially Selected Scottish Heather Honey Roast Ham Slices 120g,£1.99,120g,chilled-food
3580,McCallums Scottish Whole Milk 3.6% Fat 4 Pints/2.27l,£1.45,4 Pints,chilled-food
3581,McCallums Scottish Semi-skimmed Milk 1.7% Fat 4 Pints/2.27l,£1.45,4 Pints,chilled-food
3582,McCallums Scottish Semi-skimmed Milk 1.7% Fat 6 Pints/3.41l,£2.15,6 Pints,chilled-food
3583,Emporium Low Fat Cottage Cheese With Pineapple 300g,£1.15,300g,chilled-food
3584,Specially Selected Chicken Teriyaki Cali Rolls 206g/8 Pack,£2.99,206g,chilled-food
3585,The Deli Diced Smoked Pancetta 170g,£1.99,170g,chilled-food
3586,The Deli Diced Unsmoked Pancetta 170g,£1.99,170g,chilled-food
3587,Everyday Essentials Cooked Chicken Slices 240g,£1.99,240g,chilled-food
3588,Specially Selected West Country Extra Mature Cheddar 350g,£2.99,350g,chilled-food
3589,The Deli Chorizo & Gouda Rollitos 80g,£1.85,80g,chilled-food
3590,Specially Selected Scottish Peppered Ham Slices 120g,£1.99,120g,chilled-food
3591,Specially Selected Scottish Mature Ham Slices 120g,£1.99,120g,chilled-food
3592,Greenvale Beautifully Buttery 500g,£0.95,500g,chilled-food
3593,Greenvale Beautifully Buttery Light 500g,£0.95,500g,chilled-food
3594,Acti Leaf Oat Drink With No Sugars 1l,£1.09,1L,chilled-food
3595,Plant Menu Organic Super Firm Tofu 200g,£0.89,200g,chilled-food
3596,Greenvale Meadow Flower Light Spread 500g,£1.35,500g,chilled-food
3597,Specially Selected West Country Vintage Cheddar 300g,£2.99,300g,chilled-food
3598,Carlos Garlic Baguettes Reduced Fat 420g/2 Pack,£1.49,420g,chilled-food
3599,The Deli Serrano & Gouda Rollitos 80g/8 Pack,£1.85,80g,chilled-food
3600,Quicksters All Day Breakfast Muffin 142g,£1.49,142g,chilled-food
3601,Specially Selected Vintage Red Fox Red Leicester & Sweet Chilli Cheese Bake 150g,£2.99,150g,chilled-food
3602,Ashfields Mexican Style Chicken Slices 180g,£2.85,180g,chilled-food
3603,Greenvale Light Olive Spread 500g,£1.19,500g,chilled-food
3604,Greenvale Olive Spread 500g,£1.19,500g,chilled-food
3605,Village Dairy Llaeth Y Llan Lemon Bio-live Yogurt 125g,£0.45,125g,chilled-food
3606,Nature's Glen Ayrshire Cured Heather Honey Ham 125g,£1.75,125g,chilled-food
3607,Specially Selected Gastro Chorizo Macaroni Cheese 400g,£2.99,400g,chilled-food
3608,Holly Lane Syrup Sponge Pudding 100g,£0.89,100g,chilled-food
3609,Holly Lane Chocolate Sponge Pudding 100g,£0.89,100g,chilled-food
3610,Emporium Dip-it Cheese Dip With Sour Cream & Chive Tubes 4x41g,£1.79,4x41g,chilled-food
3611,Ashfields Sweet Chilli Chicken Slices 180g,£2.85,180g,chilled-food
3612,Specially Selected Gastro Jalapeño Macaroni Cheese 400g,£2.99,400g,chilled-food
3613,Flora Buttery 450g,£1.89,450g,chilled-food
3614,Flora Lighter 450g,£1.89,450g,chilled-food
3615,Specially Selected Mango & Passion Fruit Posset 85g,£1.19,85g,chilled-food
3616,Plant Menu Organic Smoked Tofu 180g,£0.89,180g,chilled-food
3617,Specially Selected Premium Pork Sausage Rolls 188g/4 Pack,£2.39,188g,chilled-food
3618,The Deli Lemon & Herb Green Olives 140g,£1.59,140g,chilled-food
3619,The Deli Chilli & Garlic Green Olives 140g,£1.59,140g,chilled-food
3620,The Deli Marinated Tomatoes With Garlic & Oregano 140g,£1.59,140g,chilled-food
3621,The Deli Pitted Green & Black Olives With Feta 150g,£1.75,150g,chilled-food
3622,The Deli Pitted Green Olives With Cheddar 150g,£1.75,150g,chilled-food
3623,The Deli Marinated Tomatoes & Mozzarella Cheese 150g,£1.75,150g,chilled-food
3624,The Deli German Baked Sliced Ham 6x20g,£1.39,6x20g,chilled-food
3625,The Deli German Smoked Sliced Ham 6x20g,£1.39,6x20g,chilled-food
3626,Specially Selected Spanish Ibérico Ham Croquetas 108g,£1.99,108g,chilled-food
3627,Specially Selected King Prawn & Seafood Cocktail Sandwich 238g,£2.79,238g,chilled-food
3628,The Pantry Puff Pastry 320g,£0.99,320g,chilled-food
3629,The Pantry Shortcrust Pastry 320g,£0.99,320g,chilled-food
3630,Specially Selected Mango & Granola Greek Style Yogurt 150g,£1.09,150g,chilled-food
3631,Specially Selected Blueberry & Granola Greek Style Vanilla Yogurt 150g,£1.09,150g,chilled-food
3632,Specially Selected Strawberry & Granola Greek Style Yogurt 150g,£1.09,150g,chilled-food
3633,Crestwood Crustless Cheddar Cheese & Leek Quiche 150g,£1.39,150g,chilled-food
3634,Specially Selected Sicilian Queen Nocellara Olives 150g,£1.99,150g,chilled-food
3635,Specially Selected Greek Marinated Olives 145g,£1.99,145g,chilled-food
3636,Specially Selected Cream Cheese Stuffed Cherry Bell Peppers 150g,£1.99,150g,chilled-food
3637,Specially Selected Double Stuffed Giant Halkidiki Olives 150g,£1.99,150g,chilled-food
3638,"Specially Selected Chicken, Smoked Bacon & Leek Pie 250g",£2.59,250g,chilled-food
3639,Specially Selected Steak Pie 500g,£3.99,500g,chilled-food
3640,Specially Selected Steak Pie 250g,£2.59,250g,chilled-food
3641,"Specially Selected Chicken, Bacon & Leek Pie 500g",£3.99,500g,chilled-food
3642,The Pantry Rolled Puff Pastry 320g,£0.99,320g,chilled-food
3643,The Pantry Rolled Shortcrust Pastry 320g,£0.99,320g,chilled-food
3644,Cucina Spinach & Ricotta Tortelloni 300g,£1.59,300g,chilled-food
3645,Specially Selected Meatballs Albondigas 195g,£1.99,195g,chilled-food
3646,Highgrove Lard 250g,£0.50,250g,chilled-food
3647,Brooklea Lemon Cheesecake Inspired Protein Pot 200g,£0.75,200g,chilled-food
3648,Brooklea Vanilla Protein Pot 200g,£0.75,200g,chilled-food
3649,Brooklea Salted Caramel Flavour Protein Pot 200g,£0.75,200g,chilled-food
3650,Carlos Ham & Pineapple Stonebaked Pizza 355g,£2.49,355g,chilled-food
3651,Ashfields Flame Grilled Chicken Mini Fillets 170g,£2.49,170g,chilled-food
3652,Ashfields Chicken Tikka Mini Fillets 170g,£2.49,170g,chilled-food
3653,Specially Selected Prosciutto Di Parma Ham 90g,£1.99,90g,chilled-food
3654,Seriously Vintage Spreadable 110g,£1.29,110g,chilled-food
3655,Everyday Essentials Greek Style Salad Cheese 200g,£0.89,200g,chilled-food
3656,Dessert Menu Jelly & Custard 3x125g,£0.99,3x125g,chilled-food
3657,Specially Selected Parmigiano Reggiano 170g,£2.99,170g,chilled-food
3658,Emporium Mild & Creamy French Brie 200g,£1.69,200g,chilled-food
3659,Brooklea Salted Caramel Protein Mousse 200g,£1.29,200g,chilled-food
3660,Emporium Cypriot Halloumi 225g,£2.15,225g,chilled-food
3661,Acti Leaf Barista Oat Drink 1l,£1.09,1L,chilled-food
3662,Brooklea Chocolate Flavour Protein Mousse 200g,£1.29,200g,chilled-food
3663,Acti Leaf Coconut Drink 1l,£0.99,1L,chilled-food
3664,Acti Leaf Almond Unsweetened UHT Milk 1l,£0.99,1L,chilled-food
3665,Emporium Dip-it Cheese Dip With Breadsticks 4x43g,£1.79,4x43g,chilled-food
3666,Emporium Dip-it Cheese Dip With Crackers 4x43g,£1.79,4x43g,chilled-food
3667,Ashfields Ready To Eat Piri Piri Chicken Slices 180g,£2.85,180g,chilled-food
3668,Dessert Menu Chocolate Trifles 2x90g,£0.89,2x90g,chilled-food
3669,Emporium Italian Ricotta Cheese 250g,£1.29,250g,chilled-food
3670,Emporium Italian Mascarpone 250g,£1.29,250g,chilled-food
3671,Emporium British Cheddar With Pickled Onion 200g,£1.49,200g,chilled-food
3672,Lurpak Lighter Slightly Spreadable Blend Of Butter And Rapeseed Oil 500g,£4.49,500g,chilled-food
3673,Specially Selected Mango & Passionfruit Farmhouse Yogurt 125g,£0.69,125g,chilled-food
3674,Brooklea Greek Style Strawberry Yogurt 150g,£0.59,150g,chilled-food
3675,Brooklea Greek Style Vanilla Yogurt 150g,£0.59,150g,chilled-food
3676,Inspired Cuisine Sausage & Mash Filled Yorkshire Pudding 380g,£2.69,380g,chilled-food
3677,Crestwood Peppered Steak Slice 150g,£0.99,150g,chilled-food
3678,Crestwood Chicken & Bacon Slice 150g,£0.99,150g,chilled-food
3679,Specially Selected Gastro Vanilla & Mixed Berry Crumb Topped Cheesecakes 2x85g,£2.99,2x85g,chilled-food
3680,Dessert Menu Sweet Rhubarb Crumble 500g,£2.99,500g,chilled-food
3681,Dessert Menu Bramley Apple Crumble 500g,£2.99,500g,chilled-food
3682,Dessert Menu Morello Cherry Pie 540g,£2.99,540g,chilled-food
3683,Specially Selected Gastro Scottish Maris Piper Mashed Potato 400g,£1.39,400g,chilled-food
3684,Dessert Menu Bramley Apple Crumbles 270g/2 Pack,£1.89,270g,chilled-food
3685,Dessert Menu Sweet Rhubarb Crumbles 270g/2 Pack,£1.89,270g,chilled-food
3686,Specially Selected Belgian Chocolate Melt In The Middle Puddings 2x100g,£2.49,2x100g,chilled-food
3687,Specially Selected Salted Caramel Melt In The Middle Puddings 190g/2 Pack,£2.49,190g,chilled-food
3688,Ashfields Flame Grilled Chicken Slices 180g,£2.85,180g,chilled-food
3689,Eat & Go Snackin' Roast Chicken Flavour Bites 5x22.5g,£1.89,5x22.5g,chilled-food
3690,Eat & Go Snackin' Southern Fried Chicken Flavour Bites 5x22.5g,£1.89,5x22.5g,chilled-food
3691,Specially Selected Ploughman's Quiche 400g,£2.99,400g,chilled-food
3692,Dessert Menu Strawberry Trifle 600g,£2.49,600g,chilled-food
3693,Crestwood Ready To Eat Puff Pastry Corned Beef Pasties 450g/3 Pack,£1.99,450g,chilled-food
3694,Emporium Breaded Halloumi Fries 170g/10 Pack,£2.49,170g,chilled-food
3695,Emporium British Grated Red Leicester Cheese 250g,£2.19,250g,chilled-food
3696,Emporium Grated Cheddar & Mozzarella Cheese 250g,£2.19,250g,chilled-food
3697,Eat & Go Sweet Chilli Chicken Skewers 100g/10 Pack,£1.75,100g,chilled-food
3698,Specially Selected Chargrilled Spanish Chorizo 175g,£1.99,175g,chilled-food
3699,Specially Selected Potato & Onion Tortilla 200g,£1.99,200g,chilled-food
3700,Inspired Cuisine Thai Inspired Green Chicken Curry With Sticky Rice 400g,£2.49,400g,chilled-food
3701,Inspired Cuisine Char Siu Pork With Sticky Rice 400g,£2.49,400g,chilled-food
3702,"The Deli Butternut Squash, Tomato & Basil Falafel 171g",£1.25,171g,chilled-food
3703,Everyday Essentials Cooked Chicken Breast Mini Fillets 170g,£1.99,170g,chilled-food
3704,Everyday Essentials Sweet Chilli Chicken Breast Mini Fillets 170g,£1.99,170g,chilled-food
3705,Cowbelle Protein Strawberry Flavour Milkshake 330ml,£0.79,330ml,chilled-food
3706,Cowbelle Protein Chocolate Flavoured Milkshake 330ml,£0.79,330ml,chilled-food
3707,Cowbelle Salted Caramel Flavour Protein Milkshake 330ml,£0.79,330ml,chilled-food
3708,Specially Selected Korean Style BBQ Beef With Brown Rice 270g,£2.69,270g,chilled-food
3709,Ashfields British Pastrami 100g,£1.75,100g,chilled-food
3710,Ashfields BBQ Beef Brisket 100g,£1.75,100g,chilled-food
3711,Brooklea Skyr Fat Free Icelandic Style Superberry Yogurt 150g,£0.65,150g,chilled-food
3712,Eat & Go Chicken Satay Skewers With A Sweet Chilli Dip 55g/5 Pack,£0.99,55g,chilled-food
3713,Eat & Go Chicken Satay Skewers With A Chipotle BBQ Dip 55g/5 Pack,£0.99,55g,chilled-food
3714,Bilash The Taste Of India Chicken Rogan Josh With Pilau Rice 400g,£2.49,400g,chilled-food
3715,Bilash Chicken Vindaloo With Pilau Rice 400g,£2.49,400g,chilled-food
3716,Brooklea Icelandic Style Raspberry Yogurt 150g,£0.65,150g,chilled-food
3717,"Brooklea Fat Free Icelandic Style Yogurt Passionfruit, Mango & Papaya 150g",£0.65,150g,chilled-food
3718,Dessert Menu Milk Chocolate Trifle 500g,£2.49,500g,chilled-food
3719,Inspired Cuisine Tomato & Basil Pasta Sauce 350g,£1.59,350g,chilled-food
3720,Inspired Cuisine Tomato & Mascarpone Pasta Sauce 350g,£1.59,350g,chilled-food
3721,Dessert Menu Protein Pancakes 160g,£1.99,160g,chilled-food
3722,Brooklea Protein Peach & Passionfruit Yogurt Pouch 200g,£0.89,200g,chilled-food
3723,Brooklea Protein Raspberry Yogurt Pouch 200g,£0.89,200g,chilled-food
3724,Brooklea Protein Strawberry Yogurt Pouch 200g,£0.89,200g,chilled-food
3725,Crestwood Ready To Eat Puff Pastry Beef & Vegetable Pasty 200g,£0.69,200g,chilled-food
3726,Dairyfine Milk Chocolate Split Pot Deserts 4x90g,£2.59,4x90g,chilled-food
3727,Carlos Takeaway Stuffed Crust Cheese Feast Pizza 670g,£3.99,670g,chilled-food
3728,Carlos Stuffed Crust Pizza Double Pepperoni 691g,£3.99,691g,chilled-food
3729,Frasers Macaroni Cheese 800g,£3.79,800g,chilled-food
3730,The Deli Egg Mayo Deli Filler 250g,£1.49,250g,chilled-food
3731,The Deli Tuna & Sweetcorn Deli Filler 250g,£1.49,250g,chilled-food
3732,The Deli Corned Beef 260g/10 Pack,£2.29,260g,chilled-food
3733,Carlos Takeaway Fully Loaded BBQ Chicken Pizza 515g,£3.99,515g,chilled-food
3734,"Ready, Set...Cook! Pizza Dough 400g",£0.99,400g,chilled-food
3735,Inspired Cuisine Scottish Mashed Neeps 400g,£1.25,400g,chilled-food
3736,The Deli Ardennes Pâté 200g,£0.99,200g,chilled-food
3737,Emporium British Lighter Mature Grated Cheddar 250g,£2.19,250g,chilled-food
3738,Emporium British Half Fat Mature Grated Cheddar 250g,£2.19,250g,chilled-food
3739,Ashfields British Honey Ham 115g,£0.85,115g,chilled-food
3740,Specially Selected Brussels & Shallots Pâté 170g,£1.69,170g,chilled-food
3741,Specially Selected Venison & Red Fruits Pâté 170g,£1.69,170g,chilled-food
3742,The Deli Smoked Pork Sausage 260g,£1.99,260g,chilled-food
3743,Eat & Go BBQ Flavour Chicken Skewers 100g/10 Pack,£1.75,100g,chilled-food
3744,Specially Selected Salted Caramel 4x125g,£1.79,4x125g,chilled-food
3745,The Deli Smoked Pork Sausage 160g,£1.59,160g,chilled-food
3746,The Deli Smoked Reduced Fat Pork Sausage 160g,£1.59,160g,chilled-food
3747,Specially Selected Parmigiano Reggiano & Roasted Tomato Spiralli Pasta Salad 220g,£1.59,220g,chilled-food
3748,Everyday Essentials Grated Mozzarella 500g,£2.99,500g,chilled-food
3749,The Deli Smoked Pork Sausage With Garlic 160g,£1.59,160g,chilled-food
3750,Downies Of Whitehills Traditional Cullen Skink 300g,£1.79,300g,chilled-food
3751,The Deli Smoked Pork Sausage With Chilli 160g,£1.59,160g,chilled-food
3752,"Specially Selected Bacon, Lettuce & Tomato Sandwich 232g",£2.79,232g,chilled-food
3753,Crestwood Cheese & Onion Quiche 400g,£1.99,400g,chilled-food
3754,Crestwood Quiche Lorraine 400g,£1.99,400g,chilled-food
3755,"Crestwood Broccoli, Tomato & Cheese Quiche 400g",£1.99,400g,chilled-food
3756,Eat & Go Chicken & Stuffing Sandwich 209g,£1.99,209g,chilled-food
3757,"Eat & Go Bacon, Lettuce & Tomato Sandwich 209g",£1.99,209g,chilled-food
3758,Eat & Go Roast Chicken Salad Sandwich 1 Pack,£1.99,1 Pack,chilled-food
3759,Brooklea Seeded Granola Protein Yoghurt 185g,£1.29,185g,chilled-food
3760,Brooklea Berry Granola Protein Yoghurt 185g,£1.29,185g,chilled-food
3761,Eat & Go Egg & Bacon Sandwich 203g,£1.89,203g,chilled-food
3762,Lurpak Spreadable Slightly Salted Butter Blended With Rapeseed Oil 500g,£4.49,500g,chilled-food
3763,McCallums Scottish Semi-skimmed Milk 1.7% Fat 2 Pints/1.14l,£1.20,2 Pints,chilled-food
3764,McCallums Scottish Whole Milk 2 Pints,£1.20,2 Pints,chilled-food
3765,McCallums Scottish Skimmed Milk 2 Pints,£1.20,2 Pints,chilled-food
3766,Emporium Mozzarella Slices 250g/10 Pack,£2.19,250g,chilled-food
3767,Eat & Go Oak Smoked Ham & Cheddar Cheese Sandwich 177g,£1.89,177g,chilled-food
3768,Inspired Cuisine Sweet & Sour Chicken With Egg Fried Rice 400g,£2.49,400g,chilled-food
3769,Inspired Cuisine Chicken Chow Mein 400g,£2.49,400g,chilled-food
3770,The Deli Reduced Fat Coleslaw 300g,£0.75,300g,chilled-food
3771,Asia Specialties Chicken Curry With Egg Fried Rice 400g,£2.49,400g,chilled-food
3772,Inspired Cuisine Beef In Black Bean Sauce With Egg Fried Rice 400g,£2.49,400g,chilled-food
3773,Brooklea Milk Chocolate & Caramel Light Choc Pots 4x80g,£1.25,4x80g,chilled-food
3774,Brooklea Milk Chocolate Light Choc Pots 4x80g,£1.25,4x80g,chilled-food
3775,Carlos Pepperoni Pizza Fries 425g,£2.89,425g,chilled-food
3776,Specially Selected Caledonian Blue Cheese 175g,£2.29,175g,chilled-food
3777,Specially Selected Carnegie Brie Cheese 250g,£2.29,250g,chilled-food
3778,Graham's Kefir Yogurt Natural 350g,£1.09,350g,chilled-food
3779,Grahams The Family Dairy Kefir Yogurt Strawberry 350g,£1.09,350g,chilled-food
3780,"Graham's Kefir Yogurt Passion Fruit, Mango & Papaya 350g",£1.09,350g,chilled-food
3781,Brooklea Greek Mango Yogurt 150g,£0.89,150g,chilled-food
3782,The Deli Smoked Pancetta 2x85g,£1.99,2x85g,chilled-food
3783,The Deli Unsmoked Pancetta 2x85g,£1.99,2x85g,chilled-food
3784,Dessert Menu Mini Pancakes 250g,£1.99,250g,chilled-food
3785,Brooklea Authentic Greek Honey Yogurt 150g,£0.89,150g,chilled-food
3786,McCallums Scottish Organic Semi- Skimmed Milk 1.7% Fat 2 Pints/1.14l,£1.25,2 Pints,chilled-food
3787,Emporium Grated Mozzarella 250g,£2.19,250g,chilled-food
3788,Specially Selected Bang Bang Chicken With Rice & Beans 270g,£2.69,270g,chilled-food
3789,Specially Selected Coleslaw 300g,£1.25,300g,chilled-food
3790,Specially Selected Classic Smashed Avocados 150g,£1.29,150g,chilled-food
3791,Specially Selected Spicy Smashed Avocado 150g,£1.29,150g,chilled-food
3792,Specially Selected Duck & Orange Pâté 170g,£1.69,170g,chilled-food
3793,Ashfields British Peppered Ham 120g,£1.49,120g,chilled-food
3794,Brooklea Chocolate Flavour Protein Pudding 200g,£0.99,200g,chilled-food
3795,Brooklea Caramel Flavour Protein Pudding 200g,£0.99,200g,chilled-food
3796,Nature's Glen Scotch Roast Beef Topside Slices 100g,£1.49,100g,chilled-food
3797,Dessert Menu Syrup Sponge Puddings 2x110g,£1.99,2x110g,chilled-food
3798,Emporium Grana Padano 200g,£2.25,200g,chilled-food
3799,Specially Selected Mozzarella & Sun-dried Cherry Tomato Wood Fired Sourdough Pizza 490g,£3.79,490g,chilled-food
3800,Inspired Cuisine Vegetable Pakora With Tomato & Mint Sauce 200g,£1.39,200g,chilled-food
3801,Inspired Cuisine Onion Pakora 200g,£1.39,200g,chilled-food
3802,Quicksters Southern Fried Chicken Sandwich 132g,£0.99,132g,chilled-food
3803,Inspired Cuisine Red Chicken Pakora With Tomato & Mint Sauce 200g,£1.89,200g,chilled-food
3804,Inspired Cuisine Spicy Red Chicken Pakora 200g,£1.89,200g,chilled-food
3805,Cowbelle Welsh Semi-skimmed Milk Llaeth Cymreig Hanner Sgim 1 Pint,£0.85,1 Pint,chilled-food
